ength 1428
00:16:14.383363 IP6 snapstore-content-cache-1.canonical.com.https > syn-2603-8081-6ff0-7620-fa7a-1c5a-ac91-cd76.res6.spectrum.com.45920: Flags [.], seq 40190360:40191788, ack 1122, win 5, options [nop,nop,TS val 735986654 ecr 3630378766], length 1428
00:16:14.383369 IP6 snapstore-content-cache-1.canonical.com.https > syn-2603-8081-6ff0-7620-fa7a-1c5a-ac91-cd76.res6.spectrum.com.45920: Flags [.], seq 40191788:40193216, ack 1122, win 5, options [nop,nop,TS val 735986654 ecr 3630378766], length 1428
00:16:14.383375 IP6 snapstore-content-cache-1.canonical.com.https > syn-2603-8081-6ff0-7620-fa7a-1c5a-ac91-cd76.res6.spectrum.com.45920: Flags [.], seq 40193216:40194644, ack 1122, win 5, options [nop,nop,TS val 735986654 ecr 3630378766], length 1428
00:16:14.383381 IP6 snapstore-content-cache-1.canonical.com.https > syn-2603-8081-6ff0-7620-fa7a-1c5a-ac91-cd76.res6.spectrum.com.45920: Flags [.], seq 40194644:40196072, ack 1122, win 5, options [nop,nop,TS val 735986654 ecr 3630378766], length 1428
00:16:14.383491 IP6 snapstore-content-cache-1.canonical.com.https > syn-2603-8081-6ff0-7620-fa7a-1c5a-ac91-cd76.res6.spectrum.com.45920: Flags [.], seq 40196072:40197500, ack 1122, win 5, options [nop,nop,TS val 735986654 ecr 3630378766], length 1428
00:16:14.383500 IP6 snapstore-content-cache-1.canonical.com.https > syn-2603-8081-6ff0-7620-fa7a-1c5a-ac91-cd76.res6.spectrum.com.45920: Flags [.], seq 40197500:40198928, ack 1122, win 5, options [nop,nop,TS val 735986654 ecr 3630378766], length 1428
00:16:14.383505 IP6 snapstore-content-cache-1.canonical.com.https > syn-2603-8081-6ff0-7620-fa7a-1c5a-ac91-cd76.res6.spectrum.com.45920: Flags [.], seq 40198928:40200356, ack 1122, win 5, options [nop,nop,TS val 735986654 ecr 3630378766], length 1428
00:16:14.383509 IP6 snapstore-content-cache-1.canonical.com.https > syn-2603-8081-6ff0-7620-fa7a-1c5a-ac91-cd76.res6.spectrum.com.45920: Flags [.], seq 40200356:40201784, ack 1122, win 5, options [nop,nop,TS val 735986654 ecr 3630378766], length 1428
00:16:14.383513 IP6 snapstore-content-cache-1.canonical.com.https > syn-2603-8081-6ff0-7620-fa7a-1c5a-ac91-cd76.res6.spectrum.com.45920: Flags [.], seq 40201784:40203212, ack 1122, win 5, options [nop,nop,TS val 735986654 ecr 3630378766], length 1428
00:16:14.383517 IP6 snapstore-content-cache-1.canonical.com.https > syn-2603-8081-6ff0-7620-fa7a-1c5a-ac91-cd76.res6.spectrum.com.45920: Flags [P.], seq 40203212:40203398, ack 1122, win 5, options [nop,nop,TS val 735986654 ecr 3630378766], length 186
00:16:14.383586 IP6 syn-2603-8081-6ff0-7620-fa7a-1c5a-ac91-cd76.res6.spectrum.com.45920 > snapstore-content-cache-1.canonical.com.https: Flags [.], ack 40203398, win 26101, options [nop,nop,TS val 3630378892 ecr 735986654], length 0
00:16:14.383895 IP6 snapstore-content-cache-1.canonical.com.https > syn-2603-8081-6ff0-7620-fa7a-1c5a-ac91-cd76.res6.spectrum.com.45920: Flags [.], seq 40203398:40204826, ack 1122, win 5, options [nop,nop,TS val 735986657 ecr 3630378768], length 1428
00:16:14.383920 IP6 snapstore-content-cache-1.canonical.com.https > syn-2603-8081-6ff0-7620-fa7a-1c5a-ac91-cd76.res6.spectrum.com.45920: Flags [.], seq 40204826:40206254, ack 1122, win 5, options [nop,nop,TS val 735986657 ecr 3630378768], length 1428
00:16:14.383927 IP6 snapstore-content-cache-1.canonical.com.https > syn-2603-8081-6ff0-7620-fa7a-1c5a-ac91-cd76.res6.spectrum.com.45920: Flags [.], seq 40206254:40207682, ack 1122, win 5, options [nop,nop,TS val 735986657 ecr 3630378768], length 1428
00:16:14.383931 IP6 snapstore-content-cache-1.canonical.com.https > syn-2603-8081-6ff0-7620-fa7a-1c5a-ac91-cd76.res6.spectrum.com.45920: Flags [.], seq 40207682:40209110, ack 1122, win 5, options [nop,nop,TS val 735986657 ecr 3630378768], length 1428
00:16:14.383948 IP6 syn-2603-8081-6ff0-7620-fa7a-1c5a-ac91-cd76.res6.spectrum.com.45920 > snapstore-content-cache-1.canonical.com.https: Flags [.], ack 40209110, win 26101, options [nop,nop,TS val 3630378893 ecr 735986657], length 0
00:16:14.383972 IP6 snapstore-content-cache-1.canonical.com.https > syn-2603-8081-6ff0-7620-fa7a-1c5a-ac91-cd76.res6.spectrum.com.45920: Flags [.], seq 40209110:40210538, ack 1122, win 5, options [nop,nop,TS val 735986657 ecr 3630378768], length 1428
00:16:14.383989 IP6 snapstore-content-cache-1.canonical.com.https > syn-2603-8081-6ff0-7620-fa7a-1c5a-ac91-cd76.res6.spectrum.com.45920: Flags [.], seq 40210538:40211966, ack 1122, win 5, options [nop,nop,TS val 735986657 ecr 3630378768], length 1428
00:16:14.383993 IP6 snapstore-content-cache-1.canonical.com.https > syn-2603-8081-6ff0-7620-fa7a-1c5a-ac91-cd76.res6.spectrum.com.45920: Flags [.], seq 40211966:40213394, ack 1122, win 5, options [nop,nop,TS val 735986657 ecr 3630378768], length 1428
00:16:14.383997 IP6 snapstore-content-cache-1.canonical.com.https > syn-2603-8081-6ff0-7620-fa7a-1c5a-ac91-cd76.res6.spectrum.com.45920: Flags [.], seq 40213394:40214822, ack 1122, win 5, options [nop,nop,TS val 735986657 ecr 3630378768], length 1428
00:16:14.384051 IP6 snapstore-content-cache-1.canonical.com.https > syn-2603-8081-6ff0-7620-fa7a-1c5a-ac91-cd76.res6.spectrum.com.45920: Flags [.], seq 40214822:40216250, ack 1122, win 5, options [nop,nop,TS val 735986657 ecr 3630378768], length 1428
00:16:14.384058 IP6 snapstore-content-cache-1.canonical.com.https > syn-2603-8081-6ff0-7620-fa7a-1c5a-ac91-cd76.res6.spectrum.com.45920: Flags [.], seq 40216250:40217678, ack 1122, win 5, options [nop,nop,TS val 735986657 ecr 3630378768], length 1428
00:16:14.384061 IP6 snapstore-content-cache-1.canonical.com.https > syn-2603-8081-6ff0-7620-fa7a-1c5a-ac91-cd76.res6.spectrum.com.45920: Flags [.], seq 40217678:40219106, ack 1122, win 5, options [nop,nop,TS val 735986657 ecr 3630378768], length 1428
00:16:14.384064 IP6 snapstore-content-cache-1.canonical.com.https > syn-2603-8081-6ff0-7620-fa7a-1c5a-ac91-cd76.res6.spectrum.com.45920: Flags [.], seq 40219106:40220534, ack 1122, win 5, options [nop,nop,TS val 735986657 ecr 3630378768], length 1428
00:16:14.384176 IP6 syn-2603-8081-6ff0-7620-fa7a-1c5a-ac91-cd76.res6.spectrum.com.45920 > snapstore-content-cache-1.canonical.com.https: Flags [.], ack 40220534, win 26101, options [nop,nop,TS val 3630378893 ecr 735986657], length 0
00:16:14.384317 IP6 snapstore-content-cache-1.canonical.com.https > syn-2603-8081-6ff0-7620-fa7a-1c5a-ac91-cd76.res6.spectrum.com.45920: Flags [.], seq 40220534:40221962, ack 1122, win 5, options [nop,nop,TS val 735986657 ecr 3630378768], length 1428
00:16:14.384325 IP6 snapstore-content-cache-1.canonical.com.https > syn-2603-8081-6ff0-7620-fa7a-1c5a-ac91-cd76.res6.spectrum.com.45920: Flags [.], seq 40221962:40223390, ack 1122, win 5, options [nop,nop,TS val 735986657 ecr 3630378768], length 1428
00:16:14.384329 IP6 snapstore-content-cache-1.canonical.com.https > syn-2603-8081-6ff0-7620-fa7a-1c5a-ac91-cd76.res6.spectrum.com.45920: Flags [.], seq 40223390:40224818, ack 1122, win 5, options [nop,nop,TS val 735986657 ecr 3630378768], length 1428
00:16:14.384333 IP6 snapstore-content-cache-1.canonical.com.https > syn-2603-8081-6ff0-7620-fa7a-1c5a-ac91-cd76.res6.spectrum.com.45920: Flags [.], seq 40224818:40226246, ack 1122, win 5, options [nop,nop,TS val 735986657 ecr 3630378768], length 1428
00:16:14.384337 IP6 snapstore-content-cache-1.canonical.com.https > syn-2603-8081-6ff0-7620-fa7a-1c5a-ac91-cd76.res6.spectrum.com.45920: Flags [.], seq 40226246:40227674, ack 1122, win 5, options [nop,nop,TS val 735986657 ecr 3630378768], length 1428
00:16:14.384342 IP6 syn-2603-8081-6ff0-7620-fa7a-1c5a-ac91-cd76.res6.spectrum.com.45920 > snapstore-content-cache-1.canonical.com.https: Flags [.], ack 40226246, win 26101, options [nop,nop,TS val 3630378893 ecr 735986657], length 0
00:16:14.385119 IP6 snapstore-content-cache-1.canonical.com.https > syn-2603-8081-6ff0-7620-fa7a-1c5a-ac91-cd76.res6.spectrum.com.45920: Flags [.], seq 40227674:40229102, ack 1122, win 5, options [nop,nop,TS val 735986657 ecr 3630378768], length 1428
00:16:14.385138 IP6 syn-2603-8081-6ff0-7620-fa7a-1c5a-ac91-cd76.res6.spectrum.com.45920 > snapstore-content-cache-1.canonical.com.https: Flags [.], ack 40229102, win 26101, options [nop,nop,TS val 3630378894 ecr 735986657], length 0
00:16:14.385145 IP6 snapstore-content-cache-1.canonical.com.https > syn-2603-8081-6ff0-7620-fa7a-1c5a-ac91-cd76.res6.spectrum.com.45920: Flags [.], seq 40229102:40230530, ack 1122, win 5, options [nop,nop,TS val 735986657 ecr 3630378768], length 1428
00:16:14.385153 IP6 snapstore-content-cache-1.canonical.com.https > syn-2603-8081-6ff0-7620-fa7a-1c5a-ac91-cd76.res6.spectrum.com.45920: Flags [.], seq 40230530:40231958, ack 1122, win 5, options [nop,nop,TS val 735986657 ecr 3630378768], length 1428
00:16:14.385158 IP6 syn-2603-8081-6ff0-7620-fa7a-1c5a-ac91-cd76.res6.spectrum.com.45920 > snapstore-content-cache-1.canonical.com.https: Flags [.], ack 40231958, win 26101, options [nop,nop,TS val 3630378894 ecr 735986657], length 0
00:16:14.385200 IP6 snapstore-content-cache-1.canonical.com.https > syn-2603-8081-6ff0-7620-fa7a-1c5a-ac91-cd76.res6.spectrum.com.45920: Flags [.], seq 40231958:40233386, ack 1122, win 5, options [nop,nop,TS val 735986657 ecr 3630378768], length 1428
00:16:14.385207 IP6 snapstore-content-cache-1.canonical.com.https > syn-2603-8081-6ff0-7620-fa7a-1c5a-ac91-cd76.res6.spectrum.com.45920: Flags [.], seq 40233386:40234814, ack 1122, win 5, options [nop,nop,TS val 735986657 ecr 3630378768], length 1428
00:16:14.385211 IP6 snapstore-content-cache-1.canonical.com.https > syn-2603-8081-6ff0-7620-fa7a-1c5a-ac91-cd76.res6.spectrum.com.45920: Flags [.], seq 40234814:40236242, ack 1122, win 5, options [nop,nop,TS val 735986657 ecr 3630378768], length 1428
00:16:14.385215 IP6 snapstore-content-cache-1.canonical.com.https > syn-2603-8081-6ff0-7620-fa7a-1c5a-ac91-cd76.res6.spectrum.com.45920: Flags [.], seq 40236242:40237670, ack 1122, win 5, options [nop,nop,TS val 735986657 ecr 3630378768], length 1428
00:16:14.385218 IP6 snapstore-content-cache-1.canonical.com.https > syn-2603-8081-6ff0-7620-fa7a-1c5a-ac91-cd76.res6.spectrum.com.45920: Flags [.], seq 40237670:40239098, ack 1122, win 5, options [nop,nop,TS val 735986657 ecr 3630378768], length 1428
00:16:14.385219 IP6 syn-2603-8081-6ff0-7620-fa7a-1c5a-ac91-cd76.res6.spectrum.com.45920 > snapstore-content-cache-1.canonical.com.https: Flags [.], ack 40234814, win 26101, options [nop,nop,TS val 3630378894 ecr 735986657], length 0
00:16:14.385232 IP6 syn-2603-8081-6ff0-7620-fa7a-1c5a-ac91-cd76.res6.spectrum.com.45920 > snapstore-content-cache-1.canonical.com.https: Flags [.], ack 40239098, win 26101, options [nop,nop,TS val 3630378894 ecr 735986657], length 0
00:16:14.385242 IP6 snapstore-content-cache-1.canonical.com.https > syn-2603-8081-6ff0-7620-fa7a-1c5a-ac91-cd76.res6.spectrum.com.45920: Flags [.], seq 40239098:40240526, ack 1122, win 5, options [nop,nop,TS val 735986657 ecr 3630378768], length 1428
00:16:14.385249 IP6 snapstore-content-cache-1.canonical.com.https > syn-2603-8081-6ff0-7620-fa7a-1c5a-ac91-cd76.res6.spectrum.com.45920: Flags [.], seq 40240526:40241954, ack 1122, win 5, options [nop,nop,TS val 735986657 ecr 3630378768], length 1428
00:16:14.385253 IP6 snapstore-content-cache-1.canonical.com.https > syn-2603-8081-6ff0-7620-fa7a-1c5a-ac91-cd76.res6.spectrum.com.45920: Flags [.], seq 40241954:40243382, ack 1122, win 5, options [nop,nop,TS val 735986657 ecr 3630378768], length 1428
00:16:14.385257 IP6 snapstore-content-cache-1.canonical.com.https > syn-2603-8081-6ff0-7620-fa7a-1c5a-ac91-cd76.res6.spectrum.com.45920: Flags [.], seq 40243382:40244810, ack 1122, win 5, options [nop,nop,TS val 735986657 ecr 3630378768], length 1428
00:16:14.385280 IP6 snapstore-content-cache-1.canonical.com.https > syn-2603-8081-6ff0-7620-fa7a-1c5a-ac91-cd76.res6.spectrum.com.45920: Flags [.], seq 40244810:40246238, ack 1122, win 5, options [nop,nop,TS val 735986657 ecr 3630378768], length 1428
00:16:14.385285 IP6 snapstore-content-cache-1.canonical.com.https > syn-2603-8081-6ff0-7620-fa7a-1c5a-ac91-cd76.res6.spectrum.com.45920: Flags [.], seq 40246238:40247666, ack 1122, win 5, options [nop,nop,TS val 735986657 ecr 3630378768], length 1428
00:16:14.385289 IP6 snapstore-content-cache-1.canonical.com.https > syn-2603-8081-6ff0-7620-fa7a-1c5a-ac91-cd76.res6.spectrum.com.45920: Flags [.], seq 40247666:40249094, ack 1122, win 5, options [nop,nop,TS val 735986657 ecr 3630378768], length 1428
00:16:14.385292 IP6 snapstore-content-cache-1.canonical.com.https > syn-2603-8081-6ff0-7620-fa7a-1c5a-ac91-cd76.res6.spectrum.com.45920: Flags [.], seq 40249094:40250522, ack 1122, win 5, options [nop,nop,TS val 735986657 ecr 3630378768], length 1428
00:16:14.385365 IP6 snapstore-content-cache-1.canonical.com.https > syn-2603-8081-6ff0-7620-fa7a-1c5a-ac91-cd76.res6.spectrum.com.45920: Flags [.], seq 40250522:40251950, ack 1122, win 5, options [nop,nop,TS val 735986657 ecr 3630378768], length 1428
00:16:14.385373 IP6 snapstore-content-cache-1.canonical.com.https > syn-2603-8081-6ff0-7620-fa7a-1c5a-ac91-cd76.res6.spectrum.com.45920: Flags [.], seq 40251950:40253378, ack 1122, win 5, options [nop,nop,TS val 735986657 ecr 3630378768], length 1428
00:16:14.385377 IP6 snapstore-content-cache-1.canonical.com.https > syn-2603-8081-6ff0-7620-fa7a-1c5a-ac91-cd76.res6.spectrum.com.45920: Flags [.], seq 40253378:40254806, ack 1122, win 5, options [nop,nop,TS val 735986657 ecr 3630378768], length 1428
00:16:14.385381 IP6 snapstore-content-cache-1.canonical.com.https > syn-2603-8081-6ff0-7620-fa7a-1c5a-ac91-cd76.res6.spectrum.com.45920: Flags [.], seq 40254806:40256234, ack 1122, win 5, options [nop,nop,TS val 735986657 ecr 3630378768], length 1428
00:16:14.385440 IP6 snapstore-content-cache-1.canonical.com.https > syn-2603-8081-6ff0-7620-fa7a-1c5a-ac91-cd76.res6.spectrum.com.45920: Flags [.], seq 40256234:40257662, ack 1122, win 5, options [nop,nop,TS val 735986657 ecr 3630378768], length 1428
00:16:14.385446 IP6 snapstore-content-cache-1.canonical.com.https > syn-2603-8081-6ff0-7620-fa7a-1c5a-ac91-cd76.res6.spectrum.com.45920: Flags [.], seq 40257662:40259090, ack 1122, win 5, options [nop,nop,TS val 735986657 ecr 3630378768], length 1428
00:16:14.385450 IP6 snapstore-content-cache-1.canonical.com.https > syn-2603-8081-6ff0-7620-fa7a-1c5a-ac91-cd76.res6.spectrum.com.45920: Flags [.], seq 40259090:40260518, ack 1122, win 5, options [nop,nop,TS val 735986657 ecr 3630378768], length 1428
00:16:14.385454 IP6 snapstore-content-cache-1.canonical.com.https > syn-2603-8081-6ff0-7620-fa7a-1c5a-ac91-cd76.res6.spectrum.com.45920: Flags [.], seq 40260518:40261946, ack 1122, win 5, options [nop,nop,TS val 735986657 ecr 3630378768], length 1428
00:16:14.385464 IP6 syn-2603-8081-6ff0-7620-fa7a-1c5a-ac91-cd76.res6.spectrum.com.45920 > snapstore-content-cache-1.canonical.com.https: Flags [.], ack 40260518, win 26101, options [nop,nop,TS val 3630378894 ecr 735986657], length 0
00:16:14.385485 IP6 snapstore-content-cache-1.canonical.com.https > syn-2603-8081-6ff0-7620-fa7a-1c5a-ac91-cd76.res6.spectrum.com.45920: Flags [.], seq 40261946:40263374, ack 1122, win 5, options [nop,nop,TS val 735986657 ecr 3630378768], length 1428
00:16:14.385495 IP6 snapstore-content-cache-1.canonical.com.https > syn-2603-8081-6ff0-7620-fa7a-1c5a-ac91-cd76.res6.spectrum.com.45920: Flags [.], seq 40263374:40264802, ack 1122, win 5, options [nop,nop,TS val 735986657 ecr 3630378768], length 1428
00:16:14.385558 IP6 snapstore-content-cache-1.canonical.com.https > syn-2603-8081-6ff0-7620-fa7a-1c5a-ac91-cd76.res6.spectrum.com.45920: Flags [.], seq 40264802:40266230, ack 1122, win 5, options [nop,nop,TS val 735986657 ecr 3630378768], length 1428
00:16:14.385564 IP6 snapstore-content-cache-1.canonical.com.https > syn-2603-8081-6ff0-7620-fa7a-1c5a-ac91-cd76.res6.spectrum.com.45920: Flags [P.], seq 40266230:40267658, ack 1122, win 5, options [nop,nop,TS val 735986657 ecr 3630378768], length 1428
00:16:14.385568 IP6 snapstore-content-cache-1.canonical.com.https > syn-2603-8081-6ff0-7620-fa7a-1c5a-ac91-cd76.res6.spectrum.com.45920: Flags [.], seq 40267658:40269086, ack 1122, win 5, options [nop,nop,TS val 735986657 ecr 3630378771], length 1428
00:16:14.385572 IP6 snapstore-content-cache-1.canonical.com.https > syn-2603-8081-6ff0-7620-fa7a-1c5a-ac91-cd76.res6.spectrum.com.45920: Flags [.], seq 40269086:40270514, ack 1122, win 5, options [nop,nop,TS val 735986657 ecr 3630378771], length 1428
00:16:14.385607 IP6 snapstore-content-cache-1.canonical.com.https > syn-2603-8081-6ff0-7620-fa7a-1c5a-ac91-cd76.res6.spectrum.com.45920: Flags [.], seq 40270514:40271942, ack 1122, win 5, options [nop,nop,TS val 735986657 ecr 3630378771], length 1428
00:16:14.385612 IP6 snapstore-content-cache-1.canonical.com.https > syn-2603-8081-6ff0-7620-fa7a-1c5a-ac91-cd76.res6.spectrum.com.45920: Flags [.], seq 40271942:40273370, ack 1122, win 5, options [nop,nop,TS val 735986657 ecr 3630378771], length 1428
00:16:14.385623 IP6 syn-2603-8081-6ff0-7620-fa7a-1c5a-ac91-cd76.res6.spectrum.com.45920 > snapstore-content-cache-1.canonical.com.https: Flags [.], ack 40273370, win 26101, options [nop,nop,TS val 3630378894 ecr 735986657], length 0
00:16:14.385681 IP6 snapstore-content-cache-1.canonical.com.https > syn-2603-8081-6ff0-7620-fa7a-1c5a-ac91-cd76.res6.spectrum.com.45920: Flags [.], seq 40273370:40274798, ack 1122, win 5, options [nop,nop,TS val 735986657 ecr 3630378771], length 1428
00:16:14.385687 IP6 snapstore-content-cache-1.canonical.com.https > syn-2603-8081-6ff0-7620-fa7a-1c5a-ac91-cd76.res6.spectrum.com.45920: Flags [.], seq 40274798:40276226, ack 1122, win 5, options [nop,nop,TS val 735986657 ecr 3630378771], length 1428
00:16:14.385691 IP6 snapstore-content-cache-1.canonical.com.https > syn-2603-8081-6ff0-7620-fa7a-1c5a-ac91-cd76.res6.spectrum.com.45920: Flags [.], seq 40276226:40277654, ack 1122, win 5, options [nop,nop,TS val 735986657 ecr 3630378771], length 1428
00:16:14.385730 IP6 snapstore-content-cache-1.canonical.com.https > syn-2603-8081-6ff0-7620-fa7a-1c5a-ac91-cd76.res6.spectrum.com.45920: Flags [.], seq 40277654:40279082, ack 1122, win 5, options [nop,nop,TS val 735986657 ecr 3630378771], length 1428
00:16:14.385755 IP6 snapstore-content-cache-1.canonical.com.https > syn-2603-8081-6ff0-7620-fa7a-1c5a-ac91-cd76.res6.spectrum.com.45920: Flags [.], seq 40279082:40280510, ack 1122, win 5, options [nop,nop,TS val 735986657 ecr 3630378771], length 1428
00:16:14.385772 IP6 snapstore-content-cache-1.canonical.com.https > syn-2603-8081-6ff0-7620-fa7a-1c5a-ac91-cd76.res6.spectrum.com.45920: Flags [.], seq 40280510:40281938, ack 1122, win 5, options [nop,nop,TS val 735986657 ecr 3630378771], length 1428
00:16:14.385800 IP6 syn-2603-8081-6ff0-7620-fa7a-1c5a-ac91-cd76.res6.spectrum.com.45920 > snapstore-content-cache-1.canonical.com.https: Flags [.], ack 40281938, win 26101, options [nop,nop,TS val 3630378895 ecr 735986657], length 0
00:16:14.385806 IP6 snapstore-content-cache-1.canonical.com.https > syn-2603-8081-6ff0-7620-fa7a-1c5a-ac91-cd76.res6.spectrum.com.45920: Flags [.], seq 40281938:40283366, ack 1122, win 5, options [nop,nop,TS val 735986657 ecr 3630378771], length 1428
00:16:14.385814 IP6 snapstore-content-cache-1.canonical.com.https > syn-2603-8081-6ff0-7620-fa7a-1c5a-ac91-cd76.res6.spectrum.com.45920: Flags [.], seq 40283366:40284794, ack 1122, win 5, options [nop,nop,TS val 735986657 ecr 3630378771], length 1428
00:16:14.385819 IP6 snapstore-content-cache-1.canonical.com.https > syn-2603-8081-6ff0-7620-fa7a-1c5a-ac91-cd76.res6.spectrum.com.45920: Flags [.], seq 40284794:40286222, ack 1122, win 5, options [nop,nop,TS val 735986657 ecr 3630378771], length 1428
00:16:14.385821 IP6 syn-2603-8081-6ff0-7620-fa7a-1c5a-ac91-cd76.res6.spectrum.com.45920 > snapstore-content-cache-1.canonical.com.https: Flags [.], ack 40284794, win 26101, options [nop,nop,TS val 3630378895 ecr 735986657], length 0
00:16:14.385822 IP6 snapstore-content-cache-1.canonical.com.https > syn-2603-8081-6ff0-7620-fa7a-1c5a-ac91-cd76.res6.spectrum.com.45920: Flags [.], seq 40286222:40287650, ack 1122, win 5, options [nop,nop,TS val 735986657 ecr 3630378771], length 1428
00:16:14.385835 IP6 syn-2603-8081-6ff0-7620-fa7a-1c5a-ac91-cd76.res6.spectrum.com.45920 > snapstore-content-cache-1.canonical.com.https: Flags [.], ack 40287650, win 26101, options [nop,nop,TS val 3630378895 ecr 735986657], length 0
00:16:14.385890 IP6 snapstore-content-cache-1.canonical.com.https > syn-2603-8081-6ff0-7620-fa7a-1c5a-ac91-cd76.res6.spectrum.com.45920: Flags [.], seq 40287650:40289078, ack 1122, win 5, options [nop,nop,TS val 735986657 ecr 3630378771], length 1428
00:16:14.385896 IP6 snapstore-content-cache-1.canonical.com.https > syn-2603-8081-6ff0-7620-fa7a-1c5a-ac91-cd76.res6.spectrum.com.45920: Flags [.], seq 40289078:40290506, ack 1122, win 5, options [nop,nop,TS val 735986657 ecr 3630378771], length 1428
00:16:14.385900 IP6 snapstore-content-cache-1.canonical.com.https > syn-2603-8081-6ff0-7620-fa7a-1c5a-ac91-cd76.res6.spectrum.com.45920: Flags [.], seq 40290506:40291934, ack 1122, win 5, options [nop,nop,TS val 735986657 ecr 3630378771], length 1428
00:16:14.385903 IP6 snapstore-content-cache-1.canonical.com.https > syn-2603-8081-6ff0-7620-fa7a-1c5a-ac91-cd76.res6.spectrum.com.45920: Flags [.], seq 40291934:40293362, ack 1122, win 5, options [nop,nop,TS val 735986657 ecr 3630378771], length 1428
00:16:14.385998 IP6 syn-2603-8081-6ff0-7620-fa7a-1c5a-ac91-cd76.res6.spectrum.com.45920 > snapstore-content-cache-1.canonical.com.https: Flags [.], ack 40293362, win 26101, options [nop,nop,TS val 3630378895 ecr 735986657], length 0
00:16:14.386055 IP6 snapstore-content-cache-1.canonical.com.https > syn-2603-8081-6ff0-7620-fa7a-1c5a-ac91-cd76.res6.spectrum.com.45920: Flags [.], seq 40293362:40294790, ack 1122, win 5, options [nop,nop,TS val 735986657 ecr 3630378771], length 1428
00:16:14.386063 IP6 snapstore-content-cache-1.canonical.com.https > syn-2603-8081-6ff0-7620-fa7a-1c5a-ac91-cd76.res6.spectrum.com.45920: Flags [.], seq 40294790:40296218, ack 1122, win 5, options [nop,nop,TS val 735986657 ecr 3630378771], length 1428
00:16:14.386067 IP6 snapstore-content-cache-1.canonical.com.https > syn-2603-8081-6ff0-7620-fa7a-1c5a-ac91-cd76.res6.spectrum.com.45920: Flags [.], seq 40296218:40297646, ack 1122, win 5, options [nop,nop,TS val 735986657 ecr 3630378771], length 1428
00:16:14.386071 IP6 snapstore-content-cache-1.canonical.com.https > syn-2603-8081-6ff0-7620-fa7a-1c5a-ac91-cd76.res6.spectrum.com.45920: Flags [.], seq 40297646:40299074, ack 1122, win 5, options [nop,nop,TS val 735986657 ecr 3630378771], length 1428
00:16:14.386082 IP6 syn-2603-8081-6ff0-7620-fa7a-1c5a-ac91-cd76.res6.spectrum.com.45920 > snapstore-content-cache-1.canonical.com.https: Flags [.], ack 40299074, win 26101, options [nop,nop,TS val 3630378895 ecr 735986657], length 0
00:16:14.386914 IP6 snapstore-content-cache-1.canonical.com.https > syn-2603-8081-6ff0-7620-fa7a-1c5a-ac91-cd76.res6.spectrum.com.45920: Flags [.], seq 40299074:40300502, ack 1122, win 5, options [nop,nop,TS val 735986657 ecr 3630378771], length 1428
00:16:14.387038 IP6 snapstore-content-cache-1.canonical.com.https > syn-2603-8081-6ff0-7620-fa7a-1c5a-ac91-cd76.res6.spectrum.com.45920: Flags [.], seq 40300502:40301930, ack 1122, win 5, options [nop,nop,TS val 735986657 ecr 3630378771], length 1428
00:16:14.387092 IP6 snapstore-content-cache-1.canonical.com.https > syn-2603-8081-6ff0-7620-fa7a-1c5a-ac91-cd76.res6.spectrum.com.45920: Flags [.], seq 40301930:40303358, ack 1122, win 5, options [nop,nop,TS val 735986657 ecr 3630378771], length 1428
00:16:14.387128 IP6 snapstore-content-cache-1.canonical.com.https > syn-2603-8081-6ff0-7620-fa7a-1c5a-ac91-cd76.res6.spectrum.com.45920: Flags [.], seq 40303358:40304786, ack 1122, win 5, options [nop,nop,TS val 735986657 ecr 3630378771], length 1428
00:16:14.387155 IP6 snapstore-content-cache-1.canonical.com.https > syn-2603-8081-6ff0-7620-fa7a-1c5a-ac91-cd76.res6.spectrum.com.45920: Flags [.], seq 40304786:40306214, ack 1122, win 5, options [nop,nop,TS val 735986657 ecr 3630378771], length 1428
00:16:14.387174 IP6 snapstore-content-cache-1.canonical.com.https > syn-2603-8081-6ff0-7620-fa7a-1c5a-ac91-cd76.res6.spectrum.com.45920: Flags [.], seq 40306214:40307642, ack 1122, win 5, options [nop,nop,TS val 735986657 ecr 3630378771], length 1428
00:16:14.387189 IP6 snapstore-content-cache-1.canonical.com.https > syn-2603-8081-6ff0-7620-fa7a-1c5a-ac91-cd76.res6.spectrum.com.45920: Flags [.], seq 40307642:40309070, ack 1122, win 5, options [nop,nop,TS val 735986657 ecr 3630378771], length 1428
00:16:14.387212 IP6 snapstore-content-cache-1.canonical.com.https > syn-2603-8081-6ff0-7620-fa7a-1c5a-ac91-cd76.res6.spectrum.com.45920: Flags [.], seq 40309070:40310498, ack 1122, win 5, options [nop,nop,TS val 735986657 ecr 3630378771], length 1428
00:16:14.387228 IP6 snapstore-content-cache-1.canonical.com.https > syn-2603-8081-6ff0-7620-fa7a-1c5a-ac91-cd76.res6.spectrum.com.45920: Flags [.], seq 40310498:40311926, ack 1122, win 5, options [nop,nop,TS val 735986657 ecr 3630378771], length 1428
00:16:14.387261 IP6 snapstore-content-cache-1.canonical.com.https > syn-2603-8081-6ff0-7620-fa7a-1c5a-ac91-cd76.res6.spectrum.com.45920: Flags [.], seq 40311926:40313354, ack 1122, win 5, options [nop,nop,TS val 735986657 ecr 3630378771], length 1428
00:16:14.387280 IP6 snapstore-content-cache-1.canonical.com.https > syn-2603-8081-6ff0-7620-fa7a-1c5a-ac91-cd76.res6.spectrum.com.45920: Flags [.], seq 40313354:40314782, ack 1122, win 5, options [nop,nop,TS val 735986657 ecr 3630378771], length 1428
00:16:14.387290 IP6 snapstore-content-cache-1.canonical.com.https > syn-2603-8081-6ff0-7620-fa7a-1c5a-ac91-cd76.res6.spectrum.com.45920: Flags [.], seq 40314782:40316210, ack 1122, win 5, options [nop,nop,TS val 735986657 ecr 3630378771], length 1428
00:16:14.387310 IP6 snapstore-content-cache-1.canonical.com.https > syn-2603-8081-6ff0-7620-fa7a-1c5a-ac91-cd76.res6.spectrum.com.45920: Flags [.], seq 40316210:40317638, ack 1122, win 5, options [nop,nop,TS val 735986657 ecr 3630378771], length 1428
00:16:14.387326 IP6 snapstore-content-cache-1.canonical.com.https > syn-2603-8081-6ff0-7620-fa7a-1c5a-ac91-cd76.res6.spectrum.com.45920: Flags [.], seq 40317638:40319066, ack 1122, win 5, options [nop,nop,TS val 735986657 ecr 3630378771], length 1428
00:16:14.387436 IP6 snapstore-content-cache-1.canonical.com.https > syn-2603-8081-6ff0-7620-fa7a-1c5a-ac91-cd76.res6.spectrum.com.45920: Flags [.], seq 40319066:40320494, ack 1122, win 5, options [nop,nop,TS val 735986657 ecr 3630378771], length 1428
00:16:14.387489 IP6 snapstore-content-cache-1.canonical.com.https > syn-2603-8081-6ff0-7620-fa7a-1c5a-ac91-cd76.res6.spectrum.com.45920: Flags [.], seq 40320494:40321922, ack 1122, win 5, options [nop,nop,TS val 735986657 ecr 3630378771], length 1428
00:16:14.387514 IP6 snapstore-content-cache-1.canonical.com.https > syn-2603-8081-6ff0-7620-fa7a-1c5a-ac91-cd76.res6.spectrum.com.45920: Flags [.], seq 40321922:40323350, ack 1122, win 5, options [nop,nop,TS val 735986657 ecr 3630378771], length 1428
00:16:14.387678 IP6 snapstore-content-cache-1.canonical.com.https > syn-2603-8081-6ff0-7620-fa7a-1c5a-ac91-cd76.res6.spectrum.com.45920: Flags [.], seq 40323350:40324778, ack 1122, win 5, options [nop,nop,TS val 735986657 ecr 3630378771], length 1428
00:16:14.387717 IP6 snapstore-content-cache-1.canonical.com.https > syn-2603-8081-6ff0-7620-fa7a-1c5a-ac91-cd76.res6.spectrum.com.45920: Flags [.], seq 40324778:40326206, ack 1122, win 5, options [nop,nop,TS val 735986657 ecr 3630378771], length 1428
00:16:14.387742 IP6 snapstore-content-cache-1.canonical.com.https > syn-2603-8081-6ff0-7620-fa7a-1c5a-ac91-cd76.res6.spectrum.com.45920: Flags [.], seq 40326206:40327634, ack 1122, win 5, options [nop,nop,TS val 735986657 ecr 3630378771], length 1428
00:16:14.387758 IP6 snapstore-content-cache-1.canonical.com.https > syn-2603-8081-6ff0-7620-fa7a-1c5a-ac91-cd76.res6.spectrum.com.45920: Flags [.], seq 40327634:40329062, ack 1122, win 5, options [nop,nop,TS val 735986657 ecr 3630378771], length 1428
00:16:14.387813 IP6 snapstore-content-cache-1.canonical.com.https > syn-2603-8081-6ff0-7620-fa7a-1c5a-ac91-cd76.res6.spectrum.com.45920: Flags [.], seq 40329062:40330490, ack 1122, win 5, options [nop,nop,TS val 735986657 ecr 3630378771], length 1428
00:16:14.387832 IP6 snapstore-content-cache-1.canonical.com.https > syn-2603-8081-6ff0-7620-fa7a-1c5a-ac91-cd76.res6.spectrum.com.45920: Flags [P.], seq 40330490:40331918, ack 1122, win 5, options [nop,nop,TS val 735986657 ecr 3630378771], length 1428
00:16:14.387847 IP6 snapstore-content-cache-1.canonical.com.https > syn-2603-8081-6ff0-7620-fa7a-1c5a-ac91-cd76.res6.spectrum.com.45920: Flags [.], seq 40331918:40333346, ack 1122, win 5, options [nop,nop,TS val 735986658 ecr 3630378779], length 1428
00:16:14.387863 IP6 snapstore-content-cache-1.canonical.com.https > syn-2603-8081-6ff0-7620-fa7a-1c5a-ac91-cd76.res6.spectrum.com.45920: Flags [.], seq 40333346:40334774, ack 1122, win 5, options [nop,nop,TS val 735986658 ecr 3630378779], length 1428
00:16:14.387876 IP6 snapstore-content-cache-1.canonical.com.https > syn-2603-8081-6ff0-7620-fa7a-1c5a-ac91-cd76.res6.spectrum.com.45920: Flags [.], seq 40334774:40336202, ack 1122, win 5, options [nop,nop,TS val 735986658 ecr 3630378779], length 1428
00:16:14.388136 IP6 syn-2603-8081-6ff0-7620-fa7a-1c5a-ac91-cd76.res6.spectrum.com.45920 > snapstore-content-cache-1.canonical.com.https: Flags [.], ack 40336202, win 25848, options [nop,nop,TS val 3630378897 ecr 735986657], length 0
00:16:14.388231 IP6 snapstore-content-cache-1.canonical.com.https > syn-2603-8081-6ff0-7620-fa7a-1c5a-ac91-cd76.res6.spectrum.com.45920: Flags [P.], seq 40336202:40336324, ack 1122, win 5, options [nop,nop,TS val 735986658 ecr 3630378779], length 122
00:16:14.388287 IP6 snapstore-content-cache-1.canonical.com.https > syn-2603-8081-6ff0-7620-fa7a-1c5a-ac91-cd76.res6.spectrum.com.45920: Flags [.], seq 40336324:40337752, ack 1122, win 5, options [nop,nop,TS val 735986658 ecr 3630378779], length 1428
00:16:14.388318 IP6 snapstore-content-cache-1.canonical.com.https > syn-2603-8081-6ff0-7620-fa7a-1c5a-ac91-cd76.res6.spectrum.com.45920: Flags [.], seq 40337752:40339180, ack 1122, win 5, options [nop,nop,TS val 735986658 ecr 3630378779], length 1428
00:16:14.388339 IP6 snapstore-content-cache-1.canonical.com.https > syn-2603-8081-6ff0-7620-fa7a-1c5a-ac91-cd76.res6.spectrum.com.45920: Flags [.], seq 40339180:40340608, ack 1122, win 5, options [nop,nop,TS val 735986658 ecr 3630378779], length 1428
00:16:14.388357 IP6 snapstore-content-cache-1.canonical.com.https > syn-2603-8081-6ff0-7620-fa7a-1c5a-ac91-cd76.res6.spectrum.com.45920: Flags [.], seq 40340608:40342036, ack 1122, win 5, options [nop,nop,TS val 735986658 ecr 3630378779], length 1428
00:16:14.388377 IP6 snapstore-content-cache-1.canonical.com.https > syn-2603-8081-6ff0-7620-fa7a-1c5a-ac91-cd76.res6.spectrum.com.45920: Flags [.], seq 40342036:40343464, ack 1122, win 5, options [nop,nop,TS val 735986658 ecr 3630378779], length 1428
00:16:14.388390 IP6 snapstore-content-cache-1.canonical.com.https > syn-2603-8081-6ff0-7620-fa7a-1c5a-ac91-cd76.res6.spectrum.com.45920: Flags [.], seq 40343464:40344892, ack 1122, win 5, options [nop,nop,TS val 735986658 ecr 3630378779], length 1428
00:16:14.388414 IP6 snapstore-content-cache-1.canonical.com.https > syn-2603-8081-6ff0-7620-fa7a-1c5a-ac91-cd76.res6.spectrum.com.45920: Flags [.], seq 40344892:40346320, ack 1122, win 5, options [nop,nop,TS val 735986658 ecr 3630378779], length 1428
00:16:14.388431 IP6 snapstore-content-cache-1.canonical.com.https > syn-2603-8081-6ff0-7620-fa7a-1c5a-ac91-cd76.res6.spectrum.com.45920: Flags [.], seq 40346320:40347748, ack 1122, win 5, options [nop,nop,TS val 735986658 ecr 3630378779], length 1428
00:16:14.388450 IP6 snapstore-content-cache-1.canonical.com.https > syn-2603-8081-6ff0-7620-fa7a-1c5a-ac91-cd76.res6.spectrum.com.45920: Flags [.], seq 40347748:40349176, ack 1122, win 5, options [nop,nop,TS val 735986658 ecr 3630378779], length 1428
00:16:14.388464 IP6 snapstore-content-cache-1.canonical.com.https > syn-2603-8081-6ff0-7620-fa7a-1c5a-ac91-cd76.res6.spectrum.com.45920: Flags [.], seq 40349176:40350604, ack 1122, win 5, options [nop,nop,TS val 735986658 ecr 3630378779], length 1428
00:16:14.388478 IP6 snapstore-content-cache-1.canonical.com.https > syn-2603-8081-6ff0-7620-fa7a-1c5a-ac91-cd76.res6.spectrum.com.45920: Flags [.], seq 40350604:40352032, ack 1122, win 5, options [nop,nop,TS val 735986658 ecr 3630378779], length 1428
00:16:14.388485 IP6 snapstore-content-cache-1.canonical.com.https > syn-2603-8081-6ff0-7620-fa7a-1c5a-ac91-cd76.res6.spectrum.com.45920: Flags [P.], seq 40352032:40352666, ack 1122, win 5, options [nop,nop,TS val 735986658 ecr 3630378779], length 634
00:16:14.388495 IP6 snapstore-content-cache-1.canonical.com.https > syn-2603-8081-6ff0-7620-fa7a-1c5a-ac91-cd76.res6.spectrum.com.45920: Flags [.], seq 40352666:40354094, ack 1122, win 5, options [nop,nop,TS val 735986658 ecr 3630378779], length 1428
00:16:14.388503 IP6 snapstore-content-cache-1.canonical.com.https > syn-2603-8081-6ff0-7620-fa7a-1c5a-ac91-cd76.res6.spectrum.com.45920: Flags [.], seq 40354094:40355522, ack 1122, win 5, options [nop,nop,TS val 735986658 ecr 3630378779], length 1428
00:16:14.388510 IP6 snapstore-content-cache-1.canonical.com.https > syn-2603-8081-6ff0-7620-fa7a-1c5a-ac91-cd76.res6.spectrum.com.45920: Flags [.], seq 40355522:40356950, ack 1122, win 5, options [nop,nop,TS val 735986658 ecr 3630378779], length 1428
00:16:14.388518 IP6 snapstore-content-cache-1.canonical.com.https > syn-2603-8081-6ff0-7620-fa7a-1c5a-ac91-cd76.res6.spectrum.com.45920: Flags [.], seq 40356950:40358378, ack 1122, win 5, options [nop,nop,TS val 735986658 ecr 3630378779], length 1428
00:16:14.388529 IP6 snapstore-content-cache-1.canonical.com.https > syn-2603-8081-6ff0-7620-fa7a-1c5a-ac91-cd76.res6.spectrum.com.45920: Flags [.], seq 40358378:40359806, ack 1122, win 5, options [nop,nop,TS val 735986658 ecr 3630378779], length 1428
00:16:14.388535 IP6 snapstore-content-cache-1.canonical.com.https > syn-2603-8081-6ff0-7620-fa7a-1c5a-ac91-cd76.res6.spectrum.com.45920: Flags [.], seq 40359806:40361234, ack 1122, win 5, options [nop,nop,TS val 735986658 ecr 3630378779], length 1428
00:16:14.388541 IP6 snapstore-content-cache-1.canonical.com.https > syn-2603-8081-6ff0-7620-fa7a-1c5a-ac91-cd76.res6.spectrum.com.45920: Flags [.], seq 40361234:40362662, ack 1122, win 5, options [nop,nop,TS val 735986658 ecr 3630378779], length 1428
00:16:14.388548 IP6 snapstore-content-cache-1.canonical.com.https > syn-2603-8081-6ff0-7620-fa7a-1c5a-ac91-cd76.res6.spectrum.com.45920: Flags [.], seq 40362662:40364090, ack 1122, win 5, options [nop,nop,TS val 735986658 ecr 3630378779], length 1428
00:16:14.388562 IP6 snapstore-content-cache-1.canonical.com.https > syn-2603-8081-6ff0-7620-fa7a-1c5a-ac91-cd76.res6.spectrum.com.45920: Flags [.], seq 40364090:40365518, ack 1122, win 5, options [nop,nop,TS val 735986658 ecr 3630378779], length 1428
00:16:14.388568 IP6 snapstore-content-cache-1.canonical.com.https > syn-2603-8081-6ff0-7620-fa7a-1c5a-ac91-cd76.res6.spectrum.com.45920: Flags [.], seq 40365518:40366946, ack 1122, win 5, options [nop,nop,TS val 735986658 ecr 3630378779], length 1428
00:16:14.388647 IP6 snapstore-content-cache-1.canonical.com.https > syn-2603-8081-6ff0-7620-fa7a-1c5a-ac91-cd76.res6.spectrum.com.45920: Flags [.], seq 40366946:40368374, ack 1122, win 5, options [nop,nop,TS val 735986658 ecr 3630378779], length 1428
00:16:14.388658 IP6 snapstore-content-cache-1.canonical.com.https > syn-2603-8081-6ff0-7620-fa7a-1c5a-ac91-cd76.res6.spectrum.com.45920: Flags [.], seq 40368374:40369802, ack 1122, win 5, options [nop,nop,TS val 735986658 ecr 3630378779], length 1428
00:16:14.388664 IP6 snapstore-content-cache-1.canonical.com.https > syn-2603-8081-6ff0-7620-fa7a-1c5a-ac91-cd76.res6.spectrum.com.45920: Flags [.], seq 40369802:40371230, ack 1122, win 5, options [nop,nop,TS val 735986658 ecr 3630378779], length 1428
00:16:14.388670 IP6 snapstore-content-cache-1.canonical.com.https > syn-2603-8081-6ff0-7620-fa7a-1c5a-ac91-cd76.res6.spectrum.com.45920: Flags [.], seq 40371230:40372658, ack 1122, win 5, options [nop,nop,TS val 735986658 ecr 3630378779], length 1428
00:16:14.388673 IP6 snapstore-content-cache-1.canonical.com.https > syn-2603-8081-6ff0-7620-fa7a-1c5a-ac91-cd76.res6.spectrum.com.45920: Flags [.], seq 40372658:40374086, ack 1122, win 5, options [nop,nop,TS val 735986658 ecr 3630378779], length 1428
00:16:14.388679 IP6 snapstore-content-cache-1.canonical.com.https > syn-2603-8081-6ff0-7620-fa7a-1c5a-ac91-cd76.res6.spectrum.com.45920: Flags [.], seq 40374086:40375514, ack 1122, win 5, options [nop,nop,TS val 735986658 ecr 3630378779], length 1428
00:16:14.388699 IP6 snapstore-content-cache-1.canonical.com.https > syn-2603-8081-6ff0-7620-fa7a-1c5a-ac91-cd76.res6.spectrum.com.45920: Flags [.], seq 40375514:40376942, ack 1122, win 5, options [nop,nop,TS val 735986658 ecr 3630378779], length 1428
00:16:14.388706 IP6 snapstore-content-cache-1.canonical.com.https > syn-2603-8081-6ff0-7620-fa7a-1c5a-ac91-cd76.res6.spectrum.com.45920: Flags [.], seq 40376942:40378370, ack 1122, win 5, options [nop,nop,TS val 735986658 ecr 3630378779], length 1428
00:16:14.388713 IP6 snapstore-content-cache-1.canonical.com.https > syn-2603-8081-6ff0-7620-fa7a-1c5a-ac91-cd76.res6.spectrum.com.45920: Flags [.], seq 40378370:40379798, ack 1122, win 5, options [nop,nop,TS val 735986658 ecr 3630378779], length 1428
00:16:14.388718 IP6 snapstore-content-cache-1.canonical.com.https > syn-2603-8081-6ff0-7620-fa7a-1c5a-ac91-cd76.res6.spectrum.com.45920: Flags [.], seq 40379798:40381226, ack 1122, win 5, options [nop,nop,TS val 735986658 ecr 3630378779], length 1428
00:16:14.388724 IP6 snapstore-content-cache-1.canonical.com.https > syn-2603-8081-6ff0-7620-fa7a-1c5a-ac91-cd76.res6.spectrum.com.45920: Flags [.], seq 40381226:40382654, ack 1122, win 5, options [nop,nop,TS val 735986658 ecr 3630378779], length 1428
00:16:14.388728 IP6 snapstore-content-cache-1.canonical.com.https > syn-2603-8081-6ff0-7620-fa7a-1c5a-ac91-cd76.res6.spectrum.com.45920: Flags [.], seq 40382654:40384082, ack 1122, win 5, options [nop,nop,TS val 735986658 ecr 3630378779], length 1428
00:16:14.388734 IP6 snapstore-content-cache-1.canonical.com.https > syn-2603-8081-6ff0-7620-fa7a-1c5a-ac91-cd76.res6.spectrum.com.45920: Flags [P.], seq 40384082:40385350, ack 1122, win 5, options [nop,nop,TS val 735986658 ecr 3630378779], length 1268
00:16:14.388738 IP6 snapstore-content-cache-1.canonical.com.https > syn-2603-8081-6ff0-7620-fa7a-1c5a-ac91-cd76.res6.spectrum.com.45920: Flags [.], seq 40385350:40386778, ack 1122, win 5, options [nop,nop,TS val 735986659 ecr 3630378779], length 1428
00:16:14.388745 IP6 snapstore-content-cache-1.canonical.com.https > syn-2603-8081-6ff0-7620-fa7a-1c5a-ac91-cd76.res6.spectrum.com.45920: Flags [.], seq 40386778:40388206, ack 1122, win 5, options [nop,nop,TS val 735986659 ecr 3630378779], length 1428
00:16:14.388789 IP6 snapstore-content-cache-1.canonical.com.https > syn-2603-8081-6ff0-7620-fa7a-1c5a-ac91-cd76.res6.spectrum.com.45920: Flags [.], seq 40388206:40389634, ack 1122, win 5, options [nop,nop,TS val 735986659 ecr 3630378779], length 1428
00:16:14.388798 IP6 snapstore-content-cache-1.canonical.com.https > syn-2603-8081-6ff0-7620-fa7a-1c5a-ac91-cd76.res6.spectrum.com.45920: Flags [.], seq 40389634:40391062, ack 1122, win 5, options [nop,nop,TS val 735986659 ecr 3630378779], length 1428
00:16:14.388805 IP6 snapstore-content-cache-1.canonical.com.https > syn-2603-8081-6ff0-7620-fa7a-1c5a-ac91-cd76.res6.spectrum.com.45920: Flags [.], seq 40391062:40392490, ack 1122, win 5, options [nop,nop,TS val 735986659 ecr 3630378779], length 1428
