8381 (correct), ack 13978, win 123, options [nop,nop,TS val 1503926588 ecr 2196785712], length 0
00:21:36.681675 IP (tos 0x0, ttl 238, id 0, offset 0, flags [none], proto TCP (6), length 100)
    lb-140-82-112-3-iad.github.com.https > ubuntu.lan.42142: Flags [P.], cksum 0xd23e (correct), seq 63297:63345, ack 13978, win 123, options [nop,nop,TS val 1503926588 ecr 2196785712], length 48
00:21:36.681688 IP (tos 0x0, ttl 64, id 18420, offset 0, flags [DF], proto TCP (6), length 52)
    ubuntu.lan.42142 > lb-140-82-112-3-iad.github.com.https: Flags [.], cksum 0x7ee6 (correct), ack 63345, win 529, options [nop,nop,TS val 2196785755 ecr 1503926588], length 0
00:21:36.702425 IP (tos 0x0, ttl 238, id 0, offset 0, flags [none], proto TCP (6), length 52)
    lb-140-82-112-3-iad.github.com.https > ubuntu.lan.42142: Flags [.], cksum 0x822a (correct), ack 14228, win 126, options [nop,nop,TS val 1503926609 ecr 2196785733], length 0
00:21:36.702444 IP (tos 0x0, ttl 238, id 0, offset 0, flags [none], proto TCP (6), length 100)
    lb-140-82-112-3-iad.github.com.https > ubuntu.lan.42142: Flags [P.], cksum 0xc392 (correct), seq 63345:63393, ack 14228, win 126, options [nop,nop,TS val 1503926609 ecr 2196785733], length 48
00:21:36.702452 IP (tos 0x0, ttl 64, id 18421, offset 0, flags [DF], proto TCP (6), length 52)
    ubuntu.lan.42142 > lb-140-82-112-3-iad.github.com.https: Flags [.], cksum 0x7e8c (correct), ack 63393, win 529, options [nop,nop,TS val 2196785776 ecr 1503926609], length 0
00:21:36.713461 IP (tos 0x0, ttl 238, id 0, offset 0, flags [none], proto TCP (6), length 52)
    lb-140-82-112-3-iad.github.com.https > ubuntu.lan.42142: Flags [.], cksum 0x803d (correct), ack 14660, win 128, options [nop,nop,TS val 1503926619 ecr 2196785734], length 0
00:21:36.713481 IP (tos 0x0, ttl 238, id 0, offset 0, flags [none], proto TCP (6), length 100)
    lb-140-82-112-3-iad.github.com.https > ubuntu.lan.42142: Flags [P.], cksum 0x73a8 (correct), seq 63393:63441, ack 14660, win 128, options [nop,nop,TS val 1503926619 ecr 2196785734], length 48
00:21:36.713493 IP (tos 0x0, ttl 64, id 18422, offset 0, flags [DF], proto TCP (6), length 52)
    ubuntu.lan.42142 > lb-140-82-112-3-iad.github.com.https: Flags [.], cksum 0x7e47 (correct), ack 63441, win 529, options [nop,nop,TS val 2196785787 ecr 1503926619], length 0
00:21:36.777157 IP (tos 0x0, ttl 238, id 0, offset 0, flags [none], proto TCP (6), length 1472)
    lb-140-82-112-3-iad.github.com.https > ubuntu.lan.42142: Flags [.], cksum 0xcb3c (correct), seq 63441:64861, ack 14660, win 128, options [nop,nop,TS val 1503926684 ecr 2196785787], length 1420
00:21:36.777178 IP (tos 0x0, ttl 64, id 18423, offset 0, flags [DF], proto TCP (6), length 52)
    ubuntu.lan.42142 > lb-140-82-112-3-iad.github.com.https: Flags [.], cksum 0x783a (correct), ack 64861, win 529, options [nop,nop,TS val 2196785851 ecr 1503926684], length 0
00:21:36.777545 IP (tos 0x0, ttl 238, id 0, offset 0, flags [none], proto TCP (6), length 1472)
    lb-140-82-112-3-iad.github.com.https > ubuntu.lan.42142: Flags [.], cksum 0x2a06 (correct), seq 64861:66281, ack 14660, win 128, options [nop,nop,TS val 1503926684 ecr 2196785787], length 1420
00:21:36.777568 IP (tos 0x0, ttl 64, id 18424, offset 0, flags [DF], proto TCP (6), length 52)
    ubuntu.lan.42142 > lb-140-82-112-3-iad.github.com.https: Flags [.], cksum 0x72ae (correct), ack 66281, win 529, options [nop,nop,TS val 2196785851 ecr 1503926684], length 0
00:21:36.777578 IP (tos 0x0, ttl 238, id 0, offset 0, flags [none], proto TCP (6), length 1472)
    lb-140-82-112-3-iad.github.com.https > ubuntu.lan.42142: Flags [.], cksum 0x90ab (correct), seq 66281:67701, ack 14660, win 128, options [nop,nop,TS val 1503926684 ecr 2196785787], length 1420
00:21:36.777585 IP (tos 0x0, ttl 64, id 18425, offset 0, flags [DF], proto TCP (6), length 52)
    ubuntu.lan.42142 > lb-140-82-112-3-iad.github.com.https: Flags [.], cksum 0x6d2c (correct), ack 67701, win 519, options [nop,nop,TS val 2196785851 ecr 1503926684], length 0
00:21:36.777653 IP (tos 0x0, ttl 238, id 0, offset 0, flags [none], proto TCP (6), length 668)
    lb-140-82-112-3-iad.github.com.https > ubuntu.lan.42142: Flags [P.], cksum 0x0d3a (correct), seq 67701:68317, ack 14660, win 128, options [nop,nop,TS val 1503926684 ecr 2196785787], length 616
00:21:36.777671 IP (tos 0x0, ttl 64, id 18426, offset 0, flags [DF], proto TCP (6), length 52)
    ubuntu.lan.42142 > lb-140-82-112-3-iad.github.com.https: Flags [.], cksum 0x6ac8 (correct), ack 68317, win 515, options [nop,nop,TS val 2196785851 ecr 1503926684], length 0
00:21:36.796359 IP (tos 0x0, ttl 238, id 0, offset 0, flags [none], proto TCP (6), length 1472)
    lb-140-82-112-3-iad.github.com.https > ubuntu.lan.42142: Flags [.], cksum 0xd880 (correct), seq 68317:69737, ack 14660, win 128, options [nop,nop,TS val 1503926703 ecr 2196785787], length 1420
00:21:36.796391 IP (tos 0x0, ttl 64, id 18427, offset 0, flags [DF], proto TCP (6), length 52)
    ubuntu.lan.42142 > lb-140-82-112-3-iad.github.com.https: Flags [.], cksum 0x6508 (correct), ack 69737, win 529, options [nop,nop,TS val 2196785870 ecr 1503926703], length 0
00:21:36.797336 IP (tos 0x0, ttl 238, id 0, offset 0, flags [none], proto TCP (6), length 1472)
    lb-140-82-112-3-iad.github.com.https > ubuntu.lan.42142: Flags [.], cksum 0xfb82 (correct), seq 69737:71157, ack 14660, win 128, options [nop,nop,TS val 1503926703 ecr 2196785787], length 1420
00:21:36.797404 IP (tos 0x0, ttl 64, id 18428, offset 0, flags [DF], proto TCP (6), length 52)
    ubuntu.lan.42142 > lb-140-82-112-3-iad.github.com.https: Flags [.], cksum 0x5f7b (correct), ack 71157, win 529, options [nop,nop,TS val 2196785871 ecr 1503926703], length 0
00:21:36.797420 IP (tos 0x0, ttl 238, id 0, offset 0, flags [none], proto TCP (6), length 1472)
    lb-140-82-112-3-iad.github.com.https > ubuntu.lan.42142: Flags [.], cksum 0x3efb (correct), seq 71157:72577, ack 14660, win 128, options [nop,nop,TS val 1503926703 ecr 2196785787], length 1420
00:21:36.797430 IP (tos 0x0, ttl 64, id 18429, offset 0, flags [DF], proto TCP (6), length 52)
    ubuntu.lan.42142 > lb-140-82-112-3-iad.github.com.https: Flags [.], cksum 0x59f9 (correct), ack 72577, win 519, options [nop,nop,TS val 2196785871 ecr 1503926703], length 0
00:21:36.797483 IP (tos 0x0, ttl 238, id 0, offset 0, flags [none], proto TCP (6), length 709)
    lb-140-82-112-3-iad.github.com.https > ubuntu.lan.42142: Flags [P.], cksum 0x03ae (correct), seq 72577:73234, ack 14660, win 128, options [nop,nop,TS val 1503926703 ecr 2196785787], length 657
00:21:36.797491 IP (tos 0x0, ttl 64, id 18430, offset 0, flags [DF], proto TCP (6), length 52)
    ubuntu.lan.42142 > lb-140-82-112-3-iad.github.com.https: Flags [.], cksum 0x576d (correct), ack 73234, win 514, options [nop,nop,TS val 2196785871 ecr 1503926703], length 0
00:21:37.057936 IP (tos 0x0, ttl 64, id 18431, offset 0, flags [DF], proto TCP (6), length 734)
    ubuntu.lan.42142 > lb-140-82-112-3-iad.github.com.https: Flags [P.], cksum 0x85cf (correct), seq 14660:15342, ack 73234, win 529, options [nop,nop,TS val 2196786132 ecr 1503926703], length 682
00:21:37.057995 IP (tos 0x0, ttl 64, id 18432, offset 0, flags [DF], proto TCP (6), length 123)
    ubuntu.lan.42142 > lb-140-82-112-3-iad.github.com.https: Flags [P.], cksum 0xbdcc (correct), seq 15342:15413, ack 73234, win 529, options [nop,nop,TS val 2196786132 ecr 1503926703], length 71
00:21:37.064678 IP (tos 0x0, ttl 64, id 18433, offset 0, flags [DF], proto TCP (6), length 257)
    ubuntu.lan.42142 > lb-140-82-112-3-iad.github.com.https: Flags [P.], cksum 0x190f (correct), seq 15413:15618, ack 73234, win 529, options [nop,nop,TS val 2196786138 ecr 1503926703], length 205
00:21:37.064701 IP (tos 0x0, ttl 64, id 18434, offset 0, flags [DF], proto TCP (6), length 121)
    ubuntu.lan.42142 > lb-140-82-112-3-iad.github.com.https: Flags [P.], cksum 0x8d3a (correct), seq 15618:15687, ack 73234, win 529, options [nop,nop,TS val 2196786138 ecr 1503926703], length 69
00:21:37.064768 IP (tos 0x0, ttl 64, id 18435, offset 0, flags [DF], proto TCP (6), length 455)
    ubuntu.lan.42142 > lb-140-82-112-3-iad.github.com.https: Flags [P.], cksum 0xeec9 (correct), seq 15687:16090, ack 73234, win 529, options [nop,nop,TS val 2196786138 ecr 1503926703], length 403
00:21:37.102483 IP (tos 0x0, ttl 238, id 0, offset 0, flags [none], proto TCP (6), length 52)
    lb-140-82-112-3-iad.github.com.https > ubuntu.lan.42142: Flags [.], cksum 0x53c4 (correct), ack 15413, win 131, options [nop,nop,TS val 1503927009 ecr 2196786132], length 0
00:21:37.102864 IP (tos 0x0, ttl 238, id 0, offset 0, flags [none], proto TCP (6), length 100)
    lb-140-82-112-3-iad.github.com.https > ubuntu.lan.42142: Flags [P.], cksum 0xb5da (correct), seq 73234:73282, ack 15413, win 131, options [nop,nop,TS val 1503927009 ecr 2196786132], length 48
00:21:37.102890 IP (tos 0x0, ttl 64, id 18436, offset 0, flags [DF], proto TCP (6), length 52)
    ubuntu.lan.42142 > lb-140-82-112-3-iad.github.com.https: Flags [.], cksum 0x4f34 (correct), ack 73282, win 529, options [nop,nop,TS val 2196786177 ecr 1503927009], length 0
00:21:37.111697 IP (tos 0x0, ttl 238, id 0, offset 0, flags [none], proto TCP (6), length 52)
    lb-140-82-112-3-iad.github.com.https > ubuntu.lan.42142: Flags [.], cksum 0x50d9 (correct), ack 16090, win 137, options [nop,nop,TS val 1503927019 ecr 2196786138], length 0
00:21:37.112069 IP (tos 0x0, ttl 238, id 0, offset 0, flags [none], proto TCP (6), length 100)
    lb-140-82-112-3-iad.github.com.https > ubuntu.lan.42142: Flags [P.], cksum 0xfd59 (correct), seq 73282:73330, ack 16090, win 137, options [nop,nop,TS val 1503927019 ecr 2196786138], length 48
00:21:37.112091 IP (tos 0x0, ttl 64, id 18437, offset 0, flags [DF], proto TCP (6), length 52)
    ubuntu.lan.42142 > lb-140-82-112-3-iad.github.com.https: Flags [.], cksum 0x4ef1 (correct), ack 73330, win 529, options [nop,nop,TS val 2196786186 ecr 1503927019], length 0
00:21:37.139281 IP (tos 0x0, ttl 238, id 0, offset 0, flags [none], proto TCP (6), length 1472)
    lb-140-82-112-3-iad.github.com.https > ubuntu.lan.42142: Flags [.], cksum 0x520e (correct), seq 73330:74750, ack 16090, win 137, options [nop,nop,TS val 1503927046 ecr 2196786138], length 1420
00:21:37.139305 IP (tos 0x0, ttl 64, id 18438, offset 0, flags [DF], proto TCP (6), length 52)
    ubuntu.lan.42142 > lb-140-82-112-3-iad.github.com.https: Flags [.], cksum 0x492f (correct), ack 74750, win 529, options [nop,nop,TS val 2196786213 ecr 1503927046], length 0
00:21:37.139609 IP (tos 0x0, ttl 238, id 0, offset 0, flags [none], proto TCP (6), length 1472)
    lb-140-82-112-3-iad.github.com.https > ubuntu.lan.42142: Flags [.], cksum 0x7780 (correct), seq 74750:76170, ack 16090, win 137, options [nop,nop,TS val 1503927046 ecr 2196786138], length 1420
00:21:37.139619 IP (tos 0x0, ttl 64, id 18439, offset 0, flags [DF], proto TCP (6), length 52)
    ubuntu.lan.42142 > lb-140-82-112-3-iad.github.com.https: Flags [.], cksum 0x43a3 (correct), ack 76170, win 529, options [nop,nop,TS val 2196786213 ecr 1503927046], length 0
00:21:37.139624 IP (tos 0x0, ttl 238, id 0, offset 0, flags [none], proto TCP (6), length 1472)
    lb-140-82-112-3-iad.github.com.https > ubuntu.lan.42142: Flags [.], cksum 0x4bf2 (correct), seq 76170:77590, ack 16090, win 137, options [nop,nop,TS val 1503927046 ecr 2196786138], length 1420
00:21:37.139630 IP (tos 0x0, ttl 64, id 18440, offset 0, flags [DF], proto TCP (6), length 52)
    ubuntu.lan.42142 > lb-140-82-112-3-iad.github.com.https: Flags [.], cksum 0x3e21 (correct), ack 77590, win 519, options [nop,nop,TS val 2196786213 ecr 1503927046], length 0
00:21:37.139634 IP (tos 0x0, ttl 238, id 0, offset 0, flags [none], proto TCP (6), length 719)
    lb-140-82-112-3-iad.github.com.https > ubuntu.lan.42142: Flags [P.], cksum 0x7a74 (correct), seq 77590:78257, ack 16090, win 137, options [nop,nop,TS val 1503927046 ecr 2196786138], length 667
00:21:37.139637 IP (tos 0x0, ttl 64, id 18441, offset 0, flags [DF], proto TCP (6), length 52)
    ubuntu.lan.42142 > lb-140-82-112-3-iad.github.com.https: Flags [.], cksum 0x3b8b (correct), ack 78257, win 514, options [nop,nop,TS val 2196786213 ecr 1503927046], length 0
00:21:37.175639 IP (tos 0x0, ttl 238, id 0, offset 0, flags [none], proto TCP (6), length 1472)
    lb-140-82-112-3-iad.github.com.https > ubuntu.lan.42142: Flags [.], cksum 0xd5ad (correct), seq 78257:79677, ack 16090, win 137, options [nop,nop,TS val 1503927083 ecr 2196786186], length 1420
00:21:37.175675 IP (tos 0x0, ttl 64, id 18442, offset 0, flags [DF], proto TCP (6), length 52)
    ubuntu.lan.42142 > lb-140-82-112-3-iad.github.com.https: Flags [.], cksum 0x35a7 (correct), ack 79677, win 529, options [nop,nop,TS val 2196786249 ecr 1503927083], length 0
00:21:37.176020 IP (tos 0x0, ttl 238, id 0, offset 0, flags [none], proto TCP (6), length 1472)
    lb-140-82-112-3-iad.github.com.https > ubuntu.lan.42142: Flags [.], cksum 0x4799 (correct), seq 79677:81097, ack 16090, win 137, options [nop,nop,TS val 1503927083 ecr 2196786186], length 1420
00:21:37.176032 IP (tos 0x0, ttl 64, id 18443, offset 0, flags [DF], proto TCP (6), length 52)
    ubuntu.lan.42142 > lb-140-82-112-3-iad.github.com.https: Flags [.], cksum 0x301a (correct), ack 81097, win 529, options [nop,nop,TS val 2196786250 ecr 1503927083], length 0
00:21:37.176036 IP (tos 0x0, ttl 238, id 0, offset 0, flags [none], proto TCP (6), length 1472)
    lb-140-82-112-3-iad.github.com.https > ubuntu.lan.42142: Flags [.], cksum 0x0bd6 (correct), seq 81097:82517, ack 16090, win 137, options [nop,nop,TS val 1503927083 ecr 2196786186], length 1420
00:21:37.176039 IP (tos 0x0, ttl 64, id 18444, offset 0, flags [DF], proto TCP (6), length 52)
    ubuntu.lan.42142 > lb-140-82-112-3-iad.github.com.https: Flags [.], cksum 0x2a98 (correct), ack 82517, win 519, options [nop,nop,TS val 2196786250 ecr 1503927083], length 0
00:21:37.176041 IP (tos 0x0, ttl 238, id 0, offset 0, flags [none], proto TCP (6), length 669)
    lb-140-82-112-3-iad.github.com.https > ubuntu.lan.42142: Flags [P.], cksum 0x4536 (correct), seq 82517:83134, ack 16090, win 137, options [nop,nop,TS val 1503927083 ecr 2196786186], length 617
00:21:37.176043 IP (tos 0x0, ttl 64, id 18445, offset 0, flags [DF], proto TCP (6), length 52)
    ubuntu.lan.42142 > lb-140-82-112-3-iad.github.com.https: Flags [.], cksum 0x2833 (correct), ack 83134, win 515, options [nop,nop,TS val 2196786250 ecr 1503927083], length 0
00:21:37.281947 IP6 (flowlabel 0x2d623, hlim 64, next-header TCP (6) payload length: 32) syn-2603-8081-6ff0-7620-fa7a-1c5a-ac91-cd76.res6.spectrum.com.50878 > 2606:4700:4408::ac40:9517.http: Flags [.], cksum 0x1c67 (correct), ack 3447, win 482, options [nop,nop,TS val 3280382614 ecr 4193900728], length 0
00:21:37.281999 IP6 (flowlabel 0xb83fc, hlim 64, next-header TCP (6) payload length: 32) syn-2603-8081-6ff0-7620-fa7a-1c5a-ac91-cd76.res6.spectrum.com.50884 > 2606:4700:4408::ac40:9517.http: Flags [.], cksum 0x516c (correct), ack 3447, win 482, options [nop,nop,TS val 3280382614 ecr 1641042184], length 0
00:21:37.304702 IP6 (flowlabel 0xc77ea, hlim 53, next-header TCP (6) payload length: 32) 2606:4700:4408::ac40:9517.http > syn-2603-8081-6ff0-7620-fa7a-1c5a-ac91-cd76.res6.spectrum.com.50878: Flags [.], cksum 0x5cbb (correct), ack 1317, win 16, options [nop,nop,TS val 4193910969 ecr 3280290835], length 0
00:21:37.305733 IP6 (flowlabel 0xa3283, hlim 53, next-header TCP (6) payload length: 32) 2606:4700:4408::ac40:9517.http > syn-2603-8081-6ff0-7620-fa7a-1c5a-ac91-cd76.res6.spectrum.com.50884: Flags [.], cksum 0x91c4 (correct), ack 1317, win 16, options [nop,nop,TS val 1641052415 ecr 3280290841], length 0
00:21:37.348022 IP6 (flowlabel 0xf24c3, hlim 64, next-header TCP (6) payload length: 71) syn-2603-8081-6ff0-7620-fa7a-1c5a-ac91-cd76.res6.spectrum.com.50462 > rs-in-f94.1e100.net.https: Flags [P.], cksum 0x774f (correct), seq 4695:4734, ack 743639, win 4968, options [nop,nop,TS val 1197091205 ecr 2825668549], length 39
00:21:37.348092 IP6 (flowlabel 0xc94be, hlim 64, next-header TCP (6) payload length: 71) syn-2603-8081-6ff0-7620-fa7a-1c5a-ac91-cd76.res6.spectrum.com.43172 > yudfwnl-in-f102.1e100.net.https: Flags [P.], cksum 0x56e7 (correct), seq 2687:2726, ack 1952, win 493, options [nop,nop,TS val 2813287896 ecr 2299860986], length 39
00:21:37.348135 IP6 (flowlabel 0xc2df7, hlim 64, next-header TCP (6) payload length: 71) syn-2603-8081-6ff0-7620-fa7a-1c5a-ac91-cd76.res6.spectrum.com.52806 > rq-in-f94.1e100.net.https: Flags [P.], cksum 0x1f04 (correct), seq 2088:2127, ack 4566, win 473, options [nop,nop,TS val 3337291264 ecr 1606974051], length 39
00:21:37.374987 IP6 (flowlabel 0x52735, hlim 119, next-header TCP (6) payload length: 71) yudfwnl-in-f102.1e100.net.https > syn-2603-8081-6ff0-7620-fa7a-1c5a-ac91-cd76.res6.spectrum.com.43172: Flags [P.], cksum 0x6489 (correct), seq 1952:1991, ack 2726, win 1045, options [nop,nop,TS val 2299919921 ecr 2813287896], length 39
00:21:37.383306 IP6 (flowlabel 0x4b65e, hlim 120, next-header TCP (6) payload length: 32) rs-in-f94.1e100.net.https > syn-2603-8081-6ff0-7620-fa7a-1c5a-ac91-cd76.res6.spectrum.com.50462: Flags [.], cksum 0x8c08 (correct), ack 4734, win 1042, options [nop,nop,TS val 2825727372 ecr 1197091205], length 0
00:21:37.385236 IP6 (flowlabel 0x4b65e, hlim 120, next-header TCP (6) payload length: 71) rs-in-f94.1e100.net.https > syn-2603-8081-6ff0-7620-fa7a-1c5a-ac91-cd76.res6.spectrum.com.50462: Flags [P.], cksum 0xb6e8 (correct), seq 743639:743678, ack 4734, win 1042, options [nop,nop,TS val 2825727375 ecr 1197091205], length 39
00:21:37.391370 IP6 (flowlabel 0xcc0a0, hlim 119, next-header TCP (6) payload length: 32) rq-in-f94.1e100.net.https > syn-2603-8081-6ff0-7620-fa7a-1c5a-ac91-cd76.res6.spectrum.com.52806: Flags [.], cksum 0x9ea1 (correct), ack 2127, win 1048, options [nop,nop,TS val 1607032811 ecr 3337291264], length 0
00:21:37.391584 IP6 (flowlabel 0xcc0a0, hlim 119, next-header TCP (6) payload length: 71) rq-in-f94.1e100.net.https > syn-2603-8081-6ff0-7620-fa7a-1c5a-ac91-cd76.res6.spectrum.com.52806: Flags [P.], cksum 0x8306 (correct), seq 4566:4605, ack 2127, win 1048, options [nop,nop,TS val 1607032811 ecr 3337291264], length 39
00:21:37.415870 IP6 (flowlabel 0xc94be, hlim 64, next-header TCP (6) payload length: 32) syn-2603-8081-6ff0-7620-fa7a-1c5a-ac91-cd76.res6.spectrum.com.43172 > yudfwnl-in-f102.1e100.net.https: Flags [.], cksum 0x0005 (correct), ack 1991, win 493, options [nop,nop,TS val 2813287964 ecr 2299919921], length 0
00:21:37.425859 IP6 (flowlabel 0xf24c3, hlim 64, next-header TCP (6) payload length: 32) syn-2603-8081-6ff0-7620-fa7a-1c5a-ac91-cd76.res6.spectrum.com.50462 > rs-in-f94.1e100.net.https: Flags [.], cksum 0x7c3a (correct), ack 743678, win 4968, options [nop,nop,TS val 1197091283 ecr 2825727375], length 0
00:21:37.431867 IP6 (flowlabel 0xc2df7, hlim 64, next-header TCP (6) payload length: 32) syn-2603-8081-6ff0-7620-fa7a-1c5a-ac91-cd76.res6.spectrum.com.52806 > rq-in-f94.1e100.net.https: Flags [.], cksum 0xa065 (correct), ack 4605, win 473, options [nop,nop,TS val 3337291348 ecr 1607032811], length 0
00:21:38.211012 IP (tos 0x0, ttl 64, id 18446, offset 0, flags [DF], proto TCP (6), length 731)
    ubuntu.lan.42142 > lb-140-82-112-3-iad.github.com.https: Flags [P.], cksum 0xb1b3 (correct), seq 16090:16769, ack 83134, win 529, options [nop,nop,TS val 2196787285 ecr 1503927083], length 679
00:21:38.211040 IP (tos 0x0, ttl 64, id 18447, offset 0, flags [DF], proto TCP (6), length 124)
    ubuntu.lan.42142 > lb-140-82-112-3-iad.github.com.https: Flags [P.], cksum 0x7227 (correct), seq 16769:16841, ack 83134, win 529, options [nop,nop,TS val 2196787285 ecr 1503927083], length 72
00:21:38.217664 IP (tos 0x0, ttl 64, id 18448, offset 0, flags [DF], proto TCP (6), length 526)
    ubuntu.lan.42142 > lb-140-82-112-3-iad.github.com.https: Flags [P.], cksum 0x933d (correct), seq 16841:17315, ack 83134, win 529, options [nop,nop,TS val 2196787291 ecr 1503927083], length 474
00:21:38.217687 IP (tos 0x0, ttl 64, id 18449, offset 0, flags [DF], proto TCP (6), length 123)
    ubuntu.lan.42142 > lb-140-82-112-3-iad.github.com.https: Flags [P.], cksum 0x0c02 (correct), seq 17315:17386, ack 83134, win 529, options [nop,nop,TS val 2196787291 ecr 1503927083], length 71
00:21:38.217746 IP (tos 0x0, ttl 64, id 18450, offset 0, flags [DF], proto TCP (6), length 454)
    ubuntu.lan.42142 > lb-140-82-112-3-iad.github.com.https: Flags [P.], cksum 0x50ed (correct), seq 17386:17788, ack 83134, win 529, options [nop,nop,TS val 2196787291 ecr 1503927083], length 402
00:21:38.251697 IP (tos 0x0, ttl 238, id 0, offset 0, flags [none], proto TCP (6), length 52)
    lb-140-82-112-3-iad.github.com.https > ubuntu.lan.42142: Flags [.], cksum 0x1e7e (correct), ack 16841, win 139, options [nop,nop,TS val 1503928158 ecr 2196787285], length 0
00:21:38.251720 IP (tos 0x0, ttl 238, id 0, offset 0, flags [none], proto TCP (6), length 100)
    lb-140-82-112-3-iad.github.com.https > ubuntu.lan.42142: Flags [P.], cksum 0x2b46 (correct), seq 83134:83182, ack 16841, win 139, options [nop,nop,TS val 1503928158 ecr 2196787285], length 48
00:21:38.251735 IP (tos 0x0, ttl 64, id 18451, offset 0, flags [DF], proto TCP (6), length 52)
    ubuntu.lan.42142 > lb-140-82-112-3-iad.github.com.https: Flags [.], cksum 0x18ed (correct), ack 83182, win 529, options [nop,nop,TS val 2196787325 ecr 1503928158], length 0
00:21:38.258159 IP (tos 0x0, ttl 238, id 0, offset 0, flags [none], proto TCP (6), length 52)
    lb-140-82-112-3-iad.github.com.https > ubuntu.lan.42142: Flags [.], cksum 0x1a88 (correct), ack 17788, win 145, options [nop,nop,TS val 1503928165 ecr 2196787291], length 0
00:21:38.258174 IP (tos 0x0, ttl 238, id 0, offset 0, flags [none], proto TCP (6), length 100)
    lb-140-82-112-3-iad.github.com.https > ubuntu.lan.42142: Flags [P.], cksum 0x6e24 (correct), seq 83182:83230, ack 17788, win 145, options [nop,nop,TS val 1503928165 ecr 2196787291], length 48
00:21:38.258182 IP (tos 0x0, ttl 64, id 18452, offset 0, flags [DF], proto TCP (6), length 52)
    ubuntu.lan.42142 > lb-140-82-112-3-iad.github.com.https: Flags [.], cksum 0x18af (correct), ack 83230, win 529, options [nop,nop,TS val 2196787332 ecr 1503928165], length 0
00:21:38.288071 IP (tos 0x0, ttl 238, id 0, offset 0, flags [none], proto TCP (6), length 1472)
    lb-140-82-112-3-iad.github.com.https > ubuntu.lan.42142: Flags [.], cksum 0x239e (correct), seq 83230:84650, ack 17788, win 145, options [nop,nop,TS val 1503928195 ecr 2196787291], length 1420
00:21:38.288094 IP (tos 0x0, ttl 64, id 18453, offset 0, flags [DF], proto TCP (6), length 52)
    ubuntu.lan.42142 > lb-140-82-112-3-iad.github.com.https: Flags [.], cksum 0x12e7 (correct), ack 84650, win 529, options [nop,nop,TS val 2196787362 ecr 1503928195], length 0
00:21:38.289093 IP (tos 0x0, ttl 238, id 0, offset 0, flags [none], proto TCP (6), length 1472)
    lb-140-82-112-3-iad.github.com.https > ubuntu.lan.42142: Flags [.], cksum 0x3e9d (correct), seq 84650:86070, ack 17788, win 145, options [nop,nop,TS val 1503928195 ecr 2196787291], length 1420
00:21:38.289118 IP (tos 0x0, ttl 64, id 18454, offset 0, flags [DF], proto TCP (6), length 52)
    ubuntu.lan.42142 > lb-140-82-112-3-iad.github.com.https: Flags [.], cksum 0x0d5a (correct), ack 86070, win 529, options [nop,nop,TS val 2196787363 ecr 1503928195], length 0
00:21:38.289126 IP (tos 0x0, ttl 238, id 0, offset 0, flags [none], proto TCP (6), length 1472)
    lb-140-82-112-3-iad.github.com.https > ubuntu.lan.42142: Flags [.], cksum 0x5735 (correct), seq 86070:87490, ack 17788, win 145, options [nop,nop,TS val 1503928195 ecr 2196787291], length 1420
00:21:38.289132 IP (tos 0x0, ttl 64, id 18455, offset 0, flags [DF], proto TCP (6), length 52)
    ubuntu.lan.42142 > lb-140-82-112-3-iad.github.com.https: Flags [.], cksum 0x07d8 (correct), ack 87490, win 519, options [nop,nop,TS val 2196787363 ecr 1503928195], length 0
00:21:38.289135 IP (tos 0x0, ttl 238, id 0, offset 0, flags [none], proto TCP (6), length 723)
    lb-140-82-112-3-iad.github.com.https > ubuntu.lan.42142: Flags [P.], cksum 0x7e71 (correct), seq 87490:88161, ack 17788, win 145, options [nop,nop,TS val 1503928195 ecr 2196787291], length 671
00:21:38.289139 IP (tos 0x0, ttl 64, id 18456, offset 0, flags [DF], proto TCP (6), length 52)
    ubuntu.lan.42142 > lb-140-82-112-3-iad.github.com.https: Flags [.], cksum 0x053e (correct), ack 88161, win 514, options [nop,nop,TS val 2196787363 ecr 1503928195], length 0
00:21:38.337419 IP (tos 0x0, ttl 238, id 0, offset 0, flags [none], proto TCP (6), length 1472)
    lb-140-82-112-3-iad.github.com.https > ubuntu.lan.42142: Flags [.], cksum 0xf15d (correct), seq 88161:89581, ack 17788, win 145, options [nop,nop,TS val 1503928244 ecr 2196787363], length 1420
00:21:38.337442 IP (tos 0x0, ttl 64, id 18457, offset 0, flags [DF], proto TCP (6), length 52)
    ubuntu.lan.42142 > lb-140-82-112-3-iad.github.com.https: Flags [.], cksum 0xff41 (correct), ack 89581, win 529, options [nop,nop,TS val 2196787411 ecr 1503928244], length 0
00:21:38.337782 IP (tos 0x0, ttl 238, id 0, offset 0, flags [none], proto TCP (6), length 1472)
    lb-140-82-112-3-iad.github.com.https > ubuntu.lan.42142: Flags [.], cksum 0x53a4 (correct), seq 89581:91001, ack 17788, win 145, options [nop,nop,TS val 1503928244 ecr 2196787363], length 1420
00:21:38.337798 IP (tos 0x0, ttl 64, id 18458, offset 0, flags [DF], proto TCP (6), length 52)
    ubuntu.lan.42142 > lb-140-82-112-3-iad.github.com.https: Flags [.], cksum 0xf9b4 (correct), ack 91001, win 529, options [nop,nop,TS val 2196787412 ecr 1503928244], length 0
00:21:38.337806 IP (tos 0x0, ttl 238, id 0, offset 0, flags [none], proto TCP (6), length 1472)
    lb-140-82-112-3-iad.github.com.https > ubuntu.lan.42142: Flags [.], cksum 0xc5dd (correct), seq 91001:92421, ack 17788, win 145, options [nop,nop,TS val 1503928244 ecr 2196787363], length 1420
00:21:38.337813 IP (tos 0x0, ttl 64, id 18459, offset 0, flags [DF], proto TCP (6), length 52)
    ubuntu.lan.42142 > lb-140-82-112-3-iad.github.com.https: Flags [.], cksum 0xf432 (correct), ack 92421, win 519, options [nop,nop,TS val 2196787412 ecr 1503928244], length 0
00:21:38.337817 IP (tos 0x0, ttl 238, id 0, offset 0, flags [none], proto TCP (6), length 672)
    lb-140-82-112-3-iad.github.com.https > ubuntu.lan.42142: Flags [P.], cksum 0x04e5 (correct), seq 92421:93041, ack 17788, win 145, options [nop,nop,TS val 1503928244 ecr 2196787363], length 620
00:21:38.337821 IP (tos 0x0, ttl 64, id 18460, offset 0, flags [DF], proto TCP (6), length 52)
    ubuntu.lan.42142 > lb-140-82-112-3-iad.github.com.https: Flags [.], cksum 0xf1ca (correct), ack 93041, win 515, options [nop,nop,TS val 2196787412 ecr 1503928244], length 0
00:21:38.764933 IP6 (class 0xc0, hlim 255, next-header ICMPv6 (58) payload length: 160) _gateway > ip6-allnodes: [icmp6 sum ok] ICMP6, router advertisement, length 160
	hop limit 64, Flags [managed, other stateful], pref high, router lifetime 1800s, reachable time 0ms, retrans timer 0ms
	  prefix info option (3), length 32 (4): syn-2603-8081-6ff0-7620-0000-0000-0000-0000.res6.spectrum.com/64, Flags [onlink, auto], valid time 86400s, pref. time 86400s
	  route info option (24), length 24 (3):  syn-2603-8081-6ff0-7620-0000-0000-0000-0000.res6.spectrum.com/60, pref=medium, lifetime=86400s
	  unknown option (21), length 32 (4): 
	  0x0000:  c003 0001 0561 7069 7336 0873 7065 6374
	  0x0010:  7275 6d03 6e65 7400 0000 0000 0000
00:21:38.767799 IP6 (hlim 1, next-header Options (0) payload length: 116) ubuntu > ff02::16: HBH (rtalert: 0x0000) (padn) [icmp6 sum ok] ICMP6, multicast listener report v2, 5 group record(s) [gaddr ff02::1:ff00:1333 to_ex, 0 source(s)] [gaddr ff02::1:ff91:cd76 to_ex, 0 source(s)] [gaddr ff02::1:ff48:1448 to_ex, 0 source(s)] [gaddr ff02::fb to_ex, 0 source(s)] [gaddr ff02::1:ff19:8b1b to_ex, 0 source(s)]
00:21:38.929930 IP6 (hlim 1, next-header Options (0) payload length: 116) ubuntu > ff02::16: HBH (rtalert: 0x0000) (padn) [icmp6 sum ok] ICMP6, multicast listener report v2, 5 group record(s) [gaddr ff02::1:ff00:1333 to_ex, 0 source(s)] [gaddr ff02::1:ff91:cd76 to_ex, 0 source(s)] [gaddr ff02::1:ff48:1448 to_ex, 0 source(s)] [gaddr ff02::fb to_ex, 0 source(s)] [gaddr ff02::1:ff19:8b1b to_ex, 0 source(s)]
00:21:39.229610 IP (tos 0x0, ttl 64, id 18461, offset 0, flags [DF], proto TCP (6), length 1264)
    ubuntu.lan.42142 > lb-140-82-112-3-iad.github.com.https: Flags [P.], cksum 0xef35 (correct), seq 17788:19000, ack 93041, win 529, options [nop,nop,TS val 2196788303 ecr 1503928244], length 1212
00:21:39.229729 IP (tos 0x0, ttl 64, id 18462, offset 0, flags [DF], proto TCP (6), length 128)
    ubuntu.lan.42142 > lb-140-82-112-3-iad.github.com.https: Flags [P.], cksum 0xe724 (correct), seq 19000:19076, ack 93041, win 529, options [nop,nop,TS val 2196788303 ecr 1503928244], length 76
00:21:39.238692 IP (tos 0x0, ttl 64, id 18463, offset 0, flags [DF], proto TCP (6), length 262)
    ubuntu.lan.42142 > lb-140-82-112-3-iad.github.com.https: Flags [P.], cksum 0x5d74 (correct), seq 19076:19286, ack 93041, win 529, options [nop,nop,TS val 2196788312 ecr 1503928244], length 210
00:21:39.238869 IP (tos 0x0, ttl 64, id 18464, offset 0, flags [DF], proto TCP (6), length 121)
    ubuntu.lan.42142 > lb-140-82-112-3-iad.github.com.https: Flags [P.], cksum 0x8d5b (correct), seq 19286:19355, ack 93041, win 529, options [nop,nop,TS val 2196788313 ecr 1503928244], length 69
00:21:39.239230 IP (tos 0x0, ttl 64, id 18465, offset 0, flags [DF], proto TCP (6), length 460)
    ubuntu.lan.42142 > lb-140-82-112-3-iad.github.com.https: Flags [P.], cksum 0xccca (correct), seq 19355:19763, ack 93041, win 529, options [nop,nop,TS val 2196788313 ecr 1503928244], length 408
00:21:39.272902 IP (tos 0x0, ttl 238, id 0, offset 0, flags [none], proto TCP (6), length 52)
    lb-140-82-112-3-iad.github.com.https > ubuntu.lan.42142: Flags [.], cksum 0xe70f (correct), ack 19076, win 148, options [nop,nop,TS val 1503929179 ecr 2196788303], length 0
00:21:39.272922 IP (tos 0x0, ttl 238, id 0, offset 0, flags [none], proto TCP (6), length 100)
    lb-140-82-112-3-iad.github.com.https > ubuntu.lan.42142: Flags [P.], cksum 0x7a92 (correct), seq 93041:93089, ack 19076, win 148, options [nop,nop,TS val 1503929179 ecr 2196788303], length 48
00:21:39.272935 IP (tos 0x0, ttl 64, id 18466, offset 0, flags [DF], proto TCP (6), length 52)
    ubuntu.lan.42142 > lb-140-82-112-3-iad.github.com.https: Flags [.], cksum 0xe287 (correct), ack 93089, win 529, options [nop,nop,TS val 2196788347 ecr 1503929179], length 0
00:21:39.297935 IP (tos 0x0, ttl 238, id 0, offset 0, flags [none], proto TCP (6), length 52)
    lb-140-82-112-3-iad.github.com.https > ubuntu.lan.42142: Flags [.], cksum 0xe5a3 (correct), ack 19355, win 150, options [nop,nop,TS val 1503929205 ecr 2196788312], length 0
00:21:39.297953 IP (tos 0x0, ttl 238, id 0, offset 0, flags [none], proto TCP (6), length 100)
    lb-140-82-112-3-iad.github.com.https > ubuntu.lan.42142: Flags [P.], cksum 0x6785 (correct), seq 93089:93137, ack 19763, win 153, options [nop,nop,TS val 1503929205 ecr 2196788313], length 48
00:21:39.297969 IP (tos 0x0, ttl 64, id 18467, offset 0, flags [DF], proto TCP (6), length 52)
    ubuntu.lan.42142 > lb-140-82-112-3-iad.github.com.https: Flags [.], cksum 0xe224 (correct), ack 93137, win 529, options [nop,nop,TS val 2196788372 ecr 1503929205], length 0
00:21:39.298172 IP (tos 0x0, ttl 238, id 0, offset 0, flags [none], proto TCP (6), length 100)
    lb-140-82-112-3-iad.github.com.https > ubuntu.lan.42142: Flags [P.], cksum 0xd011 (correct), seq 93137:93185, ack 19763, win 153, options [nop,nop,TS val 1503929205 ecr 2196788313], length 48
00:21:39.298179 IP (tos 0x0, ttl 64, id 18468, offset 0, flags [DF], proto TCP (6), length 52)
    ubuntu.lan.42142 > lb-140-82-112-3-iad.github.com.https: Flags [.], cksum 0xe1f4 (correct), ack 93185, win 529, options [nop,nop,TS val 2196788372 ecr 1503929205], length 0
00:21:39.318549 IP (tos 0x0, ttl 238, id 0, offset 0, flags [none], proto TCP (6), length 1472)
    lb-140-82-112-3-iad.github.com.https > ubuntu.lan.42142: Flags [.], cksum 0x2713 (correct), seq 93185:94605, ack 19763, win 153, options [nop,nop,TS val 1503929226 ecr 2196788347], length 1420
00:21:39.318576 IP (tos 0x0, ttl 64, id 18469, offset 0, flags [DF], proto TCP (6), length 52)
    ubuntu.lan.42142 > lb-140-82-112-3-iad.github.com.https: Flags [.], cksum 0xdc3f (correct), ack 94605, win 529, options [nop,nop,TS val 2196788392 ecr 1503929226], length 0
00:21:39.318867 IP (tos 0x0, ttl 238, id 0, offset 0, flags [none], proto TCP (6), length 1472)
    lb-140-82-112-3-iad.github.com.https > ubuntu.lan.42142: Flags [.], cksum 0x1122 (correct), seq 94605:96025, ack 19763, win 153, options [nop,nop,TS val 1503929226 ecr 2196788347], length 1420
00:21:39.318880 IP (tos 0x0, ttl 64, id 18470, offset 0, flags [DF], proto TCP (6), length 52)
    ubuntu.lan.42142 > lb-140-82-112-3-iad.github.com.https: Flags [.], cksum 0xd6b2 (correct), ack 96025, win 529, options [nop,nop,TS val 2196788393 ecr 1503929226], length 0
00:21:39.318888 IP (tos 0x0, ttl 238, id 0, offset 0, flags [none], proto TCP (6), length 1472)
    lb-140-82-112-3-iad.github.com.https > ubuntu.lan.42142: Flags [.], cksum 0xf297 (correct), seq 96025:97445, ack 19763, win 153, options [nop,nop,TS val 1503929226 ecr 2196788347], length 1420
00:21:39.318894 IP (tos 0x0, ttl 64, id 18471, offset 0, flags [DF], proto TCP (6), length 52)
    ubuntu.lan.42142 > lb-140-82-112-3-iad.github.com.https: Flags [.], cksum 0xd130 (correct), ack 97445, win 519, options [nop,nop,TS val 2196788393 ecr 1503929226], length 0
00:21:39.318897 IP (tos 0x0, ttl 238, id 0, offset 0, flags [none], proto TCP (6), length 711)
    lb-140-82-112-3-iad.github.com.https > ubuntu.lan.42142: Flags [P.], cksum 0x1ca7 (correct), seq 97445:98104, ack 19763, win 153, options [nop,nop,TS val 1503929226 ecr 2196788347], length 659
00:21:39.318901 IP (tos 0x0, ttl 64, id 18472, offset 0, flags [DF], proto TCP (6), length 52)
    ubuntu.lan.42142 > lb-140-82-112-3-iad.github.com.https: Flags [.], cksum 0xcea2 (correct), ack 98104, win 514, options [nop,nop,TS val 2196788393 ecr 1503929226], length 0
00:21:39.356802 IP (tos 0x0, ttl 238, id 0, offset 0, flags [none], proto TCP (6), length 1472)
    lb-140-82-112-3-iad.github.com.https > ubuntu.lan.42142: Flags [.], cksum 0x4953 (correct), seq 98104:99524, ack 19763, win 153, options [nop,nop,TS val 1503929264 ecr 2196788372], length 1420
00:21:39.356828 IP (tos 0x0, ttl 64, id 18473, offset 0, flags [DF], proto TCP (6), length 52)
    ubuntu.lan.42142 > lb-140-82-112-3-iad.github.com.https: Flags [.], cksum 0xc8bb (correct), ack 99524, win 529, options [nop,nop,TS val 2196788431 ecr 1503929264], length 0
00:21:39.357112 IP (tos 0x0, ttl 238, id 0, offset 0, flags [none], proto TCP (6), length 1472)
    lb-140-82-112-3-iad.github.com.https > ubuntu.lan.42142: Flags [.], cksum 0xa56a (correct), seq 99524:100944, ack 19763, win 153, options [nop,nop,TS val 1503929264 ecr 2196788372], length 1420
00:21:39.357126 IP (tos 0x0, ttl 64, id 18474, offset 0, flags [DF], proto TCP (6), length 52)
    ubuntu.lan.42142 > lb-140-82-112-3-iad.github.com.https: Flags [.], cksum 0xc32f (correct), ack 100944, win 529, options [nop,nop,TS val 2196788431 ecr 1503929264], length 0
00:21:39.357133 IP (tos 0x0, ttl 238, id 0, offset 0, flags [none], proto TCP (6), length 1472)
    lb-140-82-112-3-iad.github.com.https > ubuntu.lan.42142: Flags [.], cksum 0x3bc2 (correct), seq 100944:102364, ack 19763, win 153, options [nop,nop,TS val 1503929264 ecr 2196788372], length 1420
00:21:39.357140 IP (tos 0x0, ttl 64, id 18475, offset 0, flags [DF], proto TCP (6), length 52)
    ubuntu.lan.42142 > lb-140-82-112-3-iad.github.com.https: Flags [.], cksum 0xbdad (correct), ack 102364, win 519, options [nop,nop,TS val 2196788431 ecr 1503929264], length 0
00:21:39.357143 IP (tos 0x0, ttl 238, id 0, offset 0, flags [none], proto TCP (6), length 705)
    lb-140-82-112-3-iad.github.com.https > ubuntu.lan.42142: Flags [P.], cksum 0x9440 (correct), seq 102364:103017, ack 19763, win 153, options [nop,nop,TS val 1503929264 ecr 2196788372], length 653
00:21:39.357146 IP (tos 0x0, ttl 64, id 18476, offset 0, flags [DF], proto TCP (6), length 52)
    ubuntu.lan.42142 > lb-140-82-112-3-iad.github.com.https: Flags [.], cksum 0xbb25 (correct), ack 103017, win 514, options [nop,nop,TS val 2196788431 ecr 1503929264], length 0
00:21:40.327555 IP6 (flowlabel 0x690f3, hlim 64, next-header UDP (17) payload length: 37) syn-2603-8081-6ff0-7620-fa7a-1c5a-ac91-cd76.res6.spectrum.com.56452 > rr-in-f95.1e100.net.https: [udp sum ok] UDP, length 29
00:21:40.391851 IP6 (hlim 56, next-header UDP (17) payload length: 35) rr-in-f95.1e100.net.https > syn-2603-8081-6ff0-7620-fa7a-1c5a-ac91-cd76.res6.spectrum.com.56452: [udp sum ok] UDP, length 27
00:21:44.722173 IP (tos 0x0, ttl 64, id 18477, offset 0, flags [DF], proto TCP (6), length 732)
    ubuntu.lan.42142 > lb-140-82-112-3-iad.github.com.https: Flags [P.], cksum 0x99e8 (correct), seq 19763:20443, ack 103017, win 529, options [nop,nop,TS val 2196793796 ecr 1503929264], length 680
00:21:44.722311 IP (tos 0x0, ttl 64, id 18478, offset 0, flags [DF], proto TCP (6), length 123)
    ubuntu.lan.42142 > lb-140-82-112-3-iad.github.com.https: Flags [P.], cksum 0x99c7 (correct), seq 20443:20514, ack 103017, win 529, options [nop,nop,TS val 2196793796 ecr 1503929264], length 71
00:21:44.734516 IP (tos 0x0, ttl 64, id 18479, offset 0, flags [DF], proto TCP (6), length 257)
    ubuntu.lan.42142 > lb-140-82-112-3-iad.github.com.https: Flags [P.], cksum 0x143e (correct), seq 20514:20719, ack 103017, win 529, options [nop,nop,TS val 2196793808 ecr 1503929264], length 205
00:21:44.734568 IP (tos 0x0, ttl 64, id 18480, offset 0, flags [DF], proto TCP (6), length 123)
    ubuntu.lan.42142 > lb-140-82-112-3-iad.github.com.https: Flags [P.], cksum 0x208d (correct), seq 20719:20790, ack 103017, win 529, options [nop,nop,TS val 2196793808 ecr 1503929264], length 71
00:21:44.734732 IP (tos 0x0, ttl 64, id 18481, offset 0, flags [DF], proto TCP (6), length 453)
    ubuntu.lan.42142 > lb-140-82-112-3-iad.github.com.https: Flags [P.], cksum 0x945b (correct), seq 20790:21191, ack 103017, win 529, options [nop,nop,TS val 2196793808 ecr 1503929264], length 401
00:21:44.771204 IP (tos 0x0, ttl 238, id 0, offset 0, flags [none], proto TCP (6), length 52)
    lb-140-82-112-3-iad.github.com.https > ubuntu.lan.42142: Flags [.], cksum 0x8f81 (correct), ack 20514, win 156, options [nop,nop,TS val 1503934678 ecr 2196793796], length 0
00:21:44.771224 IP (tos 0x0, ttl 238, id 0, offset 0, flags [none], proto TCP (6), length 100)
    lb-140-82-112-3-iad.github.com.https > ubuntu.lan.42142: Flags [P.], cksum 0xc781 (correct), seq 103017:103065, ack 20514, win 156, options [nop,nop,TS val 1503934678 ecr 2196793796], length 48
00:21:44.771237 IP (tos 0x0, ttl 64, id 18482, offset 0, flags [DF], proto TCP (6), length 52)
    ubuntu.lan.42142 > lb-140-82-112-3-iad.github.com.https: Flags [.], cksum 0x8b06 (correct), ack 103065, win 529, options [nop,nop,TS val 2196793845 ecr 1503934678], length 0
00:21:44.776924 IP (tos 0x0, ttl 238, id 0, offset 0, flags [none], proto TCP (6), length 52)
    lb-140-82-112-3-iad.github.com.https > ubuntu.lan.42142: Flags [.], cksum 0x8c94 (correct), ack 21191, win 162, options [nop,nop,TS val 1503934684 ecr 2196793808], length 0
00:21:44.777235 IP (tos 0x0, ttl 238, id 0, offset 0, flags [none], proto TCP (6), length 100)
    lb-140-82-112-3-iad.github.com.https > ubuntu.lan.42142: Flags [P.], cksum 0xfa3f (correct), seq 103065:103113, ack 21191, win 162, options [nop,nop,TS val 1503934684 ecr 2196793808], length 48
00:21:44.777247 IP (tos 0x0, ttl 64, id 18483, offset 0, flags [DF], proto TCP (6), length 52)
